A.C. welding generator	เครื่องกำเนิดไฟฟ้าเชื่อมกระแสสลับ	๒๐ ก.ย. ๒๕๔๔
เม็ดโลหะกระเด็น	spatter	๒๐ ก.ย. ๒๕๔๔
แรงเริ่มเชื่อม	initial force	๒๐ ก.ย. ๒๕๔๔
แรงย้อนกลับ	backward force	๒๐ ก.ย. ๒๕๔๔
แรงเสียดทาน	friction force	๒๐ ก.ย. ๒๕๔๔
แรงยู่	upset force	๒๐ ก.ย. ๒๕๔๔
แรงยู่หลังเชื่อม	post-weld upset force	๒๐ ก.ย. ๒๕๔๔
แรงเชื่อม	welding force	๒๐ ก.ย. ๒๕๔๔
แรงกดยู่	"forge force; <a href=""/coinages/websearch.php?Wd=forging+force&amp;Sj=0"">forging force</a>"	๒๐ ก.ย. ๒๕๔๔
แรงดันเร่ง	accelerating voltage	๒๐ ก.ย. ๒๕๔๔
แรงกดอุ่นหลังเชื่อม	post-heating force	๒๐ ก.ย. ๒๕๔๔
แรงขั้วเชื่อม	electrode force	๒๐ ก.ย. ๒๕๔๔
แรงดันเริ่มอาร์ก	striking voltage	๒๐ ก.ย. ๒๕๔๔
แรงดันโหลด	load voltage	๒๐ ก.ย. ๒๕๔๔
แรงดันวงจรเปิด	open circuit voltage	๒๐ ก.ย. ๒๕๔๔
แรงดันอาร์ก	arc voltage	๒๐ ก.ย. ๒๕๔๔
แรงดันอาร์กเกิดซ้ำ	restriking voltage	๒๐ ก.ย. ๒๕๔๔
แรงดันอาร์กจริง	true arc voltage	๒๐ ก.ย. ๒๕๔๔
แรงดันไบแอส	bias voltage	๒๐ ก.ย. ๒๕๔๔
แรงดันจุดอาร์กซ้ำเป็นรอบ	cyclic reignition voltage	๒๐ ก.ย. ๒๕๔๔
แรงผลัก	forward force	๒๐ ก.ย. ๒๕๔๔
accelerating voltage	แรงดันเร่ง	๒๐ ก.ย. ๒๕๔๔
แว่นเชื่อม	"welding goggles; <a href=""/coinages/websearch.php?Wd=welding+spectacles&amp;Sj=0"">welding spectacles</a>"	๒๐ ก.ย. ๒๕๔๔
แว่นกันสะเก็ด	chipping goggles	๒๐ ก.ย. ๒๕๔๔
actual throat thickness	ความหนารอยเชื่อมจริง	๒๐ ก.ย. ๒๕๔๔
เวลาให้ความร้อน	heating time	๒๐ ก.ย. ๒๕๔๔
เวลาร้อน	"heat time; <a href=""/coinages/websearch.php?Wd=on-time&amp;Sj=0"">on-time</a>"	๒๐ ก.ย. ๒๕๔๔
เวลาร้อนระหว่างเชื่อม	weld interval heat time	๒๐ ก.ย. ๒๕๔๔
เวลาร้อนเชื่อม	weld heat time	๒๐ ก.ย. ๒๕๔๔
เวลาเสียดทาน	friction time	๒๐ ก.ย. ๒๕๔๔
เวลารอบการเชื่อม	welding cycle time	๒๐ ก.ย. ๒๕๔๔
เวลาใช้แรงกด	pressure application time	๒๐ ก.ย. ๒๕๔๔
เวลาเชื่อม	weld time	๒๐ ก.ย. ๒๕๔๔
เวลาเชื่อมยู่	upset time	๒๐ ก.ย. ๒๕๔๔
เวลาเชื่อมกดยู่	upsetting time	๒๐ ก.ย. ๒๕๔๔
เวลาเดินเครื่องเปล่า	idling time	๒๐ ก.ย. ๒๕๔๔
เวลาเย็นตัว	"cool time; <a href=""/coinages/websearch.php?Wd=off-time&amp;Sj=0"">off-time</a>"	๒๐ ก.ย. ๒๕๔๔
เวลาเว้นเชื่อม	step time	๒๐ ก.ย. ๒๕๔๔
เวลาระหว่างพัลส์	interpulse time	๒๐ ก.ย. ๒๕๔๔
เวลากระแสเชื่อมยู่	upset current time	๒๐ ก.ย. ๒๕๔๔
เวลาก่อนเชื่อม	pre-weld time	๒๐ ก.ย. ๒๕๔๔
เวลาการเชื่อม	welding time	๒๐ ก.ย. ๒๕๔๔
เวลาการหยุด	stopping time	๒๐ ก.ย. ๒๕๔๔
เวลากด	squeeze time	๒๐ ก.ย. ๒๕๔๔
เวลากดยู่	"forge time; <a href=""/coinages/websearch.php?Wd=forging+time&amp;Sj=0"">forging time</a>"	๒๐ ก.ย. ๒๕๔๔
เวลากดเชื่อม	welding pressure time	๒๐ ก.ย. ๒๕๔๔
เวลากดค้าง	"dwell time; <a href=""/coinages/websearch.php?Wd=hold+time&amp;Sj=0"">hold time</a>"	๒๐ ก.ย. ๒๕๔๔
เวลาคงความดันอุ่นหลังเชื่อม	post-heating pressure time	๒๐ ก.ย. ๒๕๔๔
เวลาคืนสภาพ	recovery time	๒๐ ก.ย. ๒๕๔๔
เวลาต่อเที่ยวเชื่อม	"rate of travel; <a href=""/coinages/websearch.php?Wd=travel+speed&amp;Sj=0"">travel speed</a>"	๒๐ ก.ย. ๒๕๔๔
เวลาแพร่ความร้อน	heat diffusion time	๒๐ ก.ย. ๒๕๔๔
เวลาวาบ	flashing time	๒๐ ก.ย. ๒๕๔๔
เวลาสัมผัส	touch time	๒๐ ก.ย. ๒๕๔๔
เวลาหลังเชื่อม	post-weld time	๒๐ ก.ย. ๒๕๔๔
เวลาหน่วงเชื่อม	weld delay time	๒๐ ก.ย. ๒๕๔๔
เวลาหน่วงกด	forge delay time	๒๐ ก.ย. ๒๕๔๔
เวลาอัตรากระแสเปลี่ยน	slope time	๒๐ ก.ย. ๒๕๔๔
เวลาอาร์ก	arcing time	๒๐ ก.ย. ๒๕๔๔
เวลาอุ่นก่อนเชื่อม, เวลาอุ่นก่อนวาบ	preheat time	๒๐ ก.ย. ๒๕๔๔
เวลาลดแรงกด	pressure decrease time	๒๐ ก.ย. ๒๕๔๔
เวลาลดระยะหัวเชื่อม	head lowering time	๒๐ ก.ย. ๒๕๔๔
เวลากระแสเสื่อม	decay time	๒๐ ก.ย. ๒๕๔๔
เวลาปล่อยเย็น	"chill time; <a href=""/coinages/websearch.php?Wd=quench+time&amp;Sj=0"">quench time</a>"	๒๐ ก.ย. ๒๕๔๔
เวลาปล่อยกระแสอุ่นหลังเชื่อม	post-heat time	๒๐ ก.ย. ๒๕๔๔
เวลาปลอดกระแส	current-off time	๒๐ ก.ย. ๒๕๔๔
เวลาปลดแรงกด	pressure-off time	๒๐ ก.ย. ๒๕๔๔
เวลาพัลส์	pulse time	๒๐ ก.ย. ๒๕๔๔
ระยะเว้นก่อนเชื่อม	"stand-off distance; <a href=""/coinages/websearch.php?Wd=stand-off+gap&amp;Sj=0"">stand-off gap</a>"	๒๐ ก.ย. ๒๕๔๔
ระยะยู่	upset length	๒๐ ก.ย. ๒๕๔๔
ระยะยู่เสียดทาน	burn-off length	๒๐ ก.ย. ๒๕๔๔
ระยะยก	lift	๒๐ ก.ย. ๒๕๔๔
ระยะเคลื่อนยู่	upset travel	๒๐ ก.ย. ๒๕๔๔
ระยะเผื่อวาบ	flashing allowance	๒๐ ก.ย. ๒๕๔๔
ระยะเผื่ออุ่นก่อนวาบ	preheating allowance	๒๐ ก.ย. ๒๕๔๔
ระยะวาบ	flashing travel	๒๐ ก.ย. ๒๕๔๔
ระยะเชื่อม	work distance	๒๐ ก.ย. ๒๕๔๔
ระยะเบน	drag	๒๐ ก.ย. ๒๕๔๔
ระยะเผื่อรวม	total allowance	๒๐ ก.ย. ๒๕๔๔
ระยะเผื่อยู่	upset allowance	๒๐ ก.ย. ๒๕๔๔
ระยะหดรวม	total loss	๒๐ ก.ย. ๒๕๔๔
ระยะหดขณะวาบ	flashing loss	๒๐ ก.ย. ๒๕๔๔
ระยะหดขณะอุ่นก่อนวาบ	preheating loss	๒๐ ก.ย. ๒๕๔๔
ระยะหลอมลึก	fusion penetration	๒๐ ก.ย. ๒๕๔๔
ระยะสึก	wearing depth	๒๐ ก.ย. ๒๕๔๔
ระยะอาร์ก	arc length	๒๐ ก.ย. ๒๕๔๔
ระยะลึก	"throat; <a href=""/coinages/websearch.php?Wd=throat+depth&amp;Sj=0"">throat depth</a>"	๒๐ ก.ย. ๒๕๔๔
ระยะชักหัวเชื่อม	machine stroke	๒๐ ก.ย. ๒๕๔๔
ระยะกดยู่	forge length	๒๐ ก.ย. ๒๕๔๔
ระยะขอบ	edge distance	๒๐ ก.ย. ๒๕๔๔
ระยะขั้วเชื่อม	"electrode clearance; <a href=""/coinages/websearch.php?Wd=electrode+gap&amp;Sj=0"">electrode gap</a>"	๒๐ ก.ย. ๒๕๔๔
ระยะชักใช้งาน	operational stroke	๒๐ ก.ย. ๒๕๔๔
ระยะปากจับ	clamp opening	๒๐ ก.ย. ๒๕๔๔
ระบบแสงส่องนำ	optical viewing system	๒๐ ก.ย. ๒๕๔๔
ระบบยกสูง	high lift system	๒๐ ก.ย. ๒๕๔๔
ระบบเชื่อมสุญญากาศเต็มที่	"full vacuum system; <a href=""/coinages/websearch.php?Wd=hard+vacuum+system&amp;Sj=0"">hard vacuum system</a>"	๒๐ ก.ย. ๒๕๔๔
ระบบเชื่อมสุญญากาศไม่สมบูรณ์	"partial vacuum system; <a href=""/coinages/websearch.php?Wd=soft+vacuum+system&amp;Sj=0"">soft vacuum system</a>"	๒๐ ก.ย. ๒๕๔๔
ระบบเชื่อมนอกสุญญากาศ	"non-vacuum system; <a href=""/coinages/websearch.php?Wd=out+of+vacuum+system&amp;Sj=0"">out of vacuum system</a>"	๒๐ ก.ย. ๒๕๔๔
ระบบหน่วงกันสะดุด	delayed non-beat	๒๐ ก.ย. ๒๕๔๔
ระบบกันสะดุด	non-beat	๒๐ ก.ย. ๒๕๔๔
ระบบนำหัวตัด	"cutter steering system; <a href=""/coinages/websearch.php?Wd=steering+system&amp;Sj=0"">steering system</a>"	๒๐ ก.ย. ๒๕๔๔
แหวนรองเชื่อมชั่วคราว	temporary backing ring	๒๐ ก.ย. ๒๕๔๔
แหวนรองเชื่อมถาวร	permanent backing ring	๒๐ ก.ย. ๒๕๔๔
แหวนรองเชื่อม	backing ring	๒๐ ก.ย. ๒๕๔๔
ม้วนลวดเชื่อม	welding wire	๒๐ ก.ย. ๒๕๔๔
ม้วนลวดเติม	filler wire	๒๐ ก.ย. ๒๕๔๔
ร่องหด	shrinkage groove	๒๐ ก.ย. ๒๕๔๔
ร่องไม่เต็ม	incompletely filled groove	๒๐ ก.ย. ๒๕๔๔
ร่องตัด	kerf	๒๐ ก.ย. ๒๕๔๔
รอยเว้าที่ฐาน, รอยเว้าที่ราก	"root concavity; <a href=""/coinages/websearch.php?Wd=suck-back&amp;Sj=0"">suck-back</a>; <a href=""/coinages/websearch.php?Wd=underwashing&amp;Sj=0"">underwashing</a>"	๒๐ ก.ย. ๒๕๔๔
รอยแหว่งขอบแนว	undercut	๒๐ ก.ย. ๒๕๔๔
รอยร้าว	crack	๒๐ ก.ย. ๒๕๔๔
รอยร้าวขณะเย็น	cold crack	๒๐ ก.ย. ๒๕๔๔
รอยร้าวขณะร้อน	hot crack	๒๐ ก.ย. ๒๕๔๔
รอยร้าวขณะแข็งตัว	solidification crack	๒๐ ก.ย. ๒๕๔๔
รอยย่น; การเกิดรอยย่น	puckering	๒๐ ก.ย. ๒๕๔๔
รอยเกย	overlap	๒๐ ก.ย. ๒๕๔๔
รอยเชื่อมยึด	tack weld	๒๐ ก.ย. ๒๕๔๔
รอยเชื่อมมุม	fillet weld	๒๐ ก.ย. ๒๕๔๔
รอยเชื่อมมุมหน้าเว้า	concave fillet weld	๒๐ ก.ย. ๒๕๔๔
รอยเชื่อมมุมหน้าราบ	flat face fillet weld	๒๐ ก.ย. ๒๕๔๔
รอยเชื่อมมุมหน้านูน	convex fillet weld	๒๐ ก.ย. ๒๕๔๔
รอยเชื่อมมุมด้านเท่า	mitre fillet weld	๒๐ ก.ย. ๒๕๔๔
รอยเชื่อมวงแหวน	fillet	๒๐ ก.ย. ๒๕๔๔
รอยเชื่อมวงรอบ; รอยเชื่อมวงแหวน	collar	๒๐ ก.ย. ๒๕๔๔
รอยเชื่อมหย่อน	sagged weld	๒๐ ก.ย. ๒๕๔๔
รอยเชื่อมอุด	plug weld	๒๐ ก.ย. ๒๕๔๔
รอยเชื่อมไหม้	burnt weld	๒๐ ก.ย. ๒๕๔๔
รอยเชื่อมกันรั่ว	"sealing weld; <a href=""/coinages/websearch.php?Wd=seal+weld&amp;Sj=0"">seal weld</a>"	๒๐ ก.ย. ๒๕๔๔
รอยเชื่อมขอบ	edge weld	๒๐ ก.ย. ๒๕๔๔
รอยเชื่อมจุดหลอม	fusion spot weld	๒๐ ก.ย. ๒๕๔๔
รอยเชื่อมชน	butt weld	๒๐ ก.ย. ๒๕๔๔
รอยเชื่อมชนรูปตัวยูเดี่ยว	single-U butt weld	๒๐ ก.ย. ๒๕๔๔
รอยเชื่อมชนรูปตัวยูคู่	double-U butt weld	๒๐ ก.ย. ๒๕๔๔
รอยเชื่อมชนรูปตัวเจเดี่ยว	single-J butt weld	๒๐ ก.ย. ๒๕๔๔
รอยเครื่องมือ	tool mark	๒๐ ก.ย. ๒๕๔๔
รอยเคาะ	chipping mark	๒๐ ก.ย. ๒๕๔๔
รอยเชื่อม; งานเชื่อม; เชื่อม	weld	๒๐ ก.ย. ๒๕๔๔
รอยเชื่อมเรียบ	flush weld	๒๐ ก.ย. ๒๕๔๔
รอยเชื่อมเว้นระยะ	intermittent weld	๒๐ ก.ย. ๒๕๔๔
รอยเชื่อมเว้นระยะสลับฟันปลา	staggered intermittent weld	๒๐ ก.ย. ๒๕๔๔
รอยเชื่อมเว้นระยะตรงกัน	chain intermittent weld	๒๐ ก.ย. ๒๕๔๔
รอยเชื่อมร่อง	groove weld	๒๐ ก.ย. ๒๕๔๔
รอยเชื่อมชนรูปตัวเจคู่	double-J butt weld	๒๐ ก.ย. ๒๕๔๔
รอยเชื่อมชนรูปตัววีเดี่ยว	single-V butt weld	๒๐ ก.ย. ๒๕๔๔
รอยเชื่อมชนรูปตัววีคู่	double-V butt weld	๒๐ ก.ย. ๒๕๔๔
รอยเชื่อมชนหน้าเฉียงเดี่ยว	single-bevel butt weld	๒๐ ก.ย. ๒๕๔๔
รอยเชื่อมชนหน้าเฉียงคู่	double-bevel butt weld	๒๐ ก.ย. ๒๕๔๔
รอยเชื่อมชนหน้าฉาก	square butt weld	๒๐ ก.ย. ๒๕๔๔
รอยเชื่อมต่อเนื่อง	continuous weld	๒๐ ก.ย. ๒๕๔๔
รอยเบน	drag line	๒๐ ก.ย. ๒๕๔๔
รอยขัด	grinding mark	๒๐ ก.ย. ๒๕๔๔
รอยค้อน	hammer mark	๒๐ ก.ย. ๒๕๔๔
รอยต่อ	joint	๒๐ ก.ย. ๒๕๔๔
รอยต่อรูปกากบาท	cruciform joint	๒๐ ก.ย. ๒๕๔๔
รอยต่อรูปตัวที	T-joint	๒๐ ก.ย. ๒๕๔๔
รอยต่อเกย	lap joint	๒๐ ก.ย. ๒๕๔๔
รอยต่อเกยรอบช่อง	slot lap joint	๒๐ ก.ย. ๒๕๔๔
รอยต่อเข้าลิ่ม	cleft joint	๒๐ ก.ย. ๒๕๔๔
รอยต่อเฉียงปากบานใน	short bell branch joint	๒๐ ก.ย. ๒๕๔๔
รอยต่อมุม	corner joint	๒๐ ก.ย. ๒๕๔๔
รอยต่อมุมฉากชิ้นเสริมเดี่ยว	single-glut square corner	๒๐ ก.ย. ๒๕๔๔
รอยต่อหางนก	dovetail joint	๒๐ ก.ย. ๒๕๔๔
รอยต่อลิ่มรูปตัวที	T-shaped pocket joint	๒๐ ก.ย. ๒๕๔๔
รอยต่อขอบ	edge joint	๒๐ ก.ย. ๒๕๔๔
รอยต่อชน	butt joint	๒๐ ก.ย. ๒๕๔๔
รอยต่อชนรูปตัวที	T-butt joint	๒๐ ก.ย. ๒๕๔๔
รอยต่อชนหน้าเรียบ	plain butt joint	๒๐ ก.ย. ๒๕๔๔
รอยต่อชนชิ้นเสริมเดี่ยว	single-glut butt joint	๒๐ ก.ย. ๒๕๔๔
รอยต่อชนชิ้นเสริมคู่	double-glut butt joint	๒๐ ก.ย. ๒๕๔๔
รอยต่อชนปากบานใน	diminishing bell butt joint	๒๐ ก.ย. ๒๕๔๔
รอยต่อชนปากบานนอก	bell butt joint	๒๐ ก.ย. ๒๕๔๔
รอยต่อตัวทีรูปอานม้า	branch T saddle joint	๒๐ ก.ย. ๒๕๔๔
รอยต่อทาบแนว	scarf joint	๒๐ ก.ย. ๒๕๔๔
รอยต่อฝังหัว	dab joint	๒๐ ก.ย. ๒๕๔๔
รอยบุ๋ม	crater pipe	๒๐ ก.ย. ๒๕๔๔
แอ่งหลอมเหลว	"molten pool; <a href=""/coinages/websearch.php?Wd=weld+pool&amp;Sj=0"">weld pool</a>"	๒๐ ก.ย. ๒๕๔๔
air-acetylene blowpipe	คันเชื่อมอากาศ-อะเซทิลีน	๒๐ ก.ย. ๒๕๔๔
air-arc cutting	การตัดด้วยอาร์กอากาศ	๒๐ ก.ย. ๒๕๔๔
รอบการเชื่อม	welding cycle	๒๐ ก.ย. ๒๕๔๔
รอบความดันสองระดับ	dual pressure cycle	๒๐ ก.ย. ๒๕๔๔
รอบความดันหลายระดับ	multi-pressure cycle	๒๐ ก.ย. ๒๕๔๔
รอบทำงาน	duty cycle	๒๐ ก.ย. ๒๕๔๔
all-position rightward welding	การเชื่อมถอยหลังทุกท่า	๒๐ ก.ย. ๒๕๔๔
all-weld test piece	ชิ้นงานทดสอบเนื้อโลหะเชื่อม	๒๐ ก.ย. ๒๕๔๔
all-weld test specimen	ชิ้นทดสอบมาตรฐานเนื้อโลหะเชื่อม	๒๐ ก.ย. ๒๕๔๔
alloy powder electrode	ลวดเชื่อมหุ้มผงโลหะ	๒๐ ก.ย. ๒๕๔๔
alternate polarity operation; alternate polarity welding	การเชื่อมขั้วสลับ	๒๐ ก.ย. ๒๕๔๔
alternate polarity welding; alternate polarity operation	การเชื่อมขั้วสลับ	๒๐ ก.ย. ๒๕๔๔
aluminothermic welding	"การเชื่อมอะลูมิโนเทอร์มิก <i>[มีความหมายเหมือนกับ <a href=""/coinages/websearch.php?Wd=thermit+welding&amp;Sj=0"">thermit welding</a>]</i>"	๒๐ ก.ย. ๒๕๔๔
analogue timer	เครื่องตั้งเวลาแบบเข็ม	๒๐ ก.ย. ๒๕๔๔
รัศมีฐาน, รัศมีราก	root radius	๒๐ ก.ย. ๒๕๔๔
angle centre electrode	ขั้วเชื่อมปลายเอียงร่วมศูนย์	๒๐ ก.ย. ๒๕๔๔
angle electrode; inclined electrode	ขั้วเชื่อมปลายเอียง	๒๐ ก.ย. ๒๕๔๔
angle of bevel	มุมหน้าเฉียง, มุมบาก	๒๐ ก.ย. ๒๕๔๔
angle of preparation; included angle	มุมร่องเชื่อม	๒๐ ก.ย. ๒๕๔๔
angle offset electrode	ขั้วเชื่อมปลายเอียงเยื้องศูนย์	๒๐ ก.ย. ๒๕๔๔
annular flame cutting nozzle; annular preheat cutting nozzle	หัวตัดวงแหวน	๒๐ ก.ย. ๒๕๔๔
annular preheat cutting nozzle; annular flame cutting nozzle	หัวตัดวงแหวน	๒๐ ก.ย. ๒๕๔๔
anvil	ทั่ง	๒๐ ก.ย. ๒๕๔๔
ราก, ฐาน	root	๒๐ ก.ย. ๒๕๔๔
รางสแลก	slag shute	๒๐ ก.ย. ๒๕๔๔
arc	อาร์ก	๒๐ ก.ย. ๒๕๔๔
arc blow	อาร์กเบน	๒๐ ก.ย. ๒๕๔๔
arc blow compensator; arc damper	ตัวหน่วงอาร์กเบน	๒๐ ก.ย. ๒๕๔๔
arc plasma cutting; plasma arc cutting	การตัดด้วยอาร์กพลาสมา	๒๐ ก.ย. ๒๕๔๔
arc plasma welding; plasma arc welding	การเชื่อมด้วยอาร์กพลาสมา	๒๐ ก.ย. ๒๕๔๔
arc spot welding	การเชื่อมจุดอาร์ก	๒๐ ก.ย. ๒๕๔๔
arc stud welding	การเชื่อมสลักอาร์ก	๒๐ ก.ย. ๒๕๔๔
arc voltage	แรงดันอาร์ก	๒๐ ก.ย. ๒๕๔๔
arc welding	การเชื่อมอาร์ก	๒๐ ก.ย. ๒๕๔๔
arc welding electrode	ลวดเชื่อมอาร์ก	๒๐ ก.ย. ๒๕๔๔
arc welding plant; arc welding set	ชุดเชื่อมอาร์ก	๒๐ ก.ย. ๒๕๔๔
arc cutting	การตัดด้วยอาร์ก	๒๐ ก.ย. ๒๕๔๔
arc damper; arc blow compensator	ตัวหน่วงอาร์กเบน	๒๐ ก.ย. ๒๕๔๔
arc eye	ตาอาร์ก	๒๐ ก.ย. ๒๕๔๔
arc fan	อาร์กรูปพัด	๒๐ ก.ย. ๒๕๔๔
arc image welding	การเชื่อมด้วยรังสีอาร์ก	๒๐ ก.ย. ๒๕๔๔
arc length	ระยะอาร์ก	๒๐ ก.ย. ๒๕๔๔
arc welding set; arc welding plant	ชุดเชื่อมอาร์ก	๒๐ ก.ย. ๒๕๔๔
arc welding transformer	หม้อแปลงเชื่อมอาร์ก	๒๐ ก.ย. ๒๕๔๔
arcing time factor	แฟกเตอร์เวลาอาร์ก	๒๐ ก.ย. ๒๕๔๔
arcing time	เวลาอาร์ก	๒๐ ก.ย. ๒๕๔๔
argon-arc torch; TIG torch	หัวเชื่อมทิก	๒๐ ก.ย. ๒๕๔๔
arm	แขนยึด	๒๐ ก.ย. ๒๕๔๔
articulated-arm cutting machine	เครื่องตัดแขนพับ	๒๐ ก.ย. ๒๕๔๔
atomic-hydrogen torch	หัวเชื่อมไฮโดรเจน	๒๐ ก.ย. ๒๕๔๔
atomic-hydrogen welding	การเชื่อมไฮโดรเจน	๒๐ ก.ย. ๒๕๔๔
รูออกซิเจนตัด	cutting oxygen bore	๒๐ ก.ย. ๒๕๔๔
automatic welding	การเชื่อมอัตโนมัติ	๒๐ ก.ย. ๒๕๔๔
automatic stud welding equipment	บริภัณฑ์งานเชื่อมสลักอัตโนมัติ	๒๐ ก.ย. ๒๕๔๔
รูขึ้น	riser	๒๐ ก.ย. ๒๕๔๔
โลหะเจือแล่นประสาน	brazing alloy	๒๐ ก.ย. ๒๕๔๔
โลหะเชื่อม	weld metal	๒๐ ก.ย. ๒๕๔๔
โลหะเชื่อมส่วนเกิน	"excess weld metal; <a href=""/coinages/websearch.php?Wd=reinforcement&amp;Sj=0"">reinforcement</a>"	๒๐ ก.ย. ๒๕๔๔
โลหะเติม	filler metal	๒๐ ก.ย. ๒๕๔๔
โลหะเติมแล้ว	deposited metal	๒๐ ก.ย. ๒๕๔๔
โลหะเติมบรอนซ์	bronze filler metal	๒๐ ก.ย. ๒๕๔๔
โลหะสเปลเตอร์	spelter	๒๐ ก.ย. ๒๕๔๔
โลหะไหลหนี	metal run-out	๒๐ ก.ย. ๒๕๔๔
โลหะชิ้นงาน	parent metal	๒๐ ก.ย. ๒๕๔๔
โล่เชื่อมประจำที่	fixed shield	๒๐ ก.ย. ๒๕๔๔
โลหะยู่	"upset; <a href=""/coinages/websearch.php?Wd=upset+metal&amp;Sj=0"">upset metal</a>"	๒๐ ก.ย. ๒๕๔๔
โลหะประสาน	braze metal	๒๐ ก.ย. ๒๕๔๔
เลนส์โฟกัส	focusing lens	๒๐ ก.ย. ๒๕๔๔
แลนซ์ออกซิเจน	oxygen lance	๒๐ ก.ย. ๒๕๔๔
แลนซ์ออกซิเจนไส้ลวด	packed lance	๒๐ ก.ย. ๒๕๔๔
แลนซ์ออกซิเจนไส้ผง	powder lance	๒๐ ก.ย. ๒๕๔๔
แก๊สคลุม	gas shield	๒๐ ก.ย. ๒๕๔๔
เกลียวต่อท่ออ่อน	threaded hose connection	๒๐ ก.ย. ๒๕๔๔
แกนนำลวดเชื่อม	"wire feed nozzle; <a href=""/coinages/websearch.php?Wd=wire+guide&amp;Sj=0"">wire guide</a>"	๒๐ ก.ย. ๒๕๔๔
แกนนำลวดเชื่อมสิ้นเปลือง	"consumable nozzle; <a href=""/coinages/websearch.php?Wd=consumable+wire+guide&amp;Sj=0"">consumable wire guide</a>"	๒๐ ก.ย. ๒๕๔๔
เขตรอยเชื่อม	weld junction	๒๐ ก.ย. ๒๕๔๔
แขนยึด	arm	๒๐ ก.ย. ๒๕๔๔
แขนโยก, กระเดื่องขั้วเชื่อม	rocker arm	๒๐ ก.ย. ๒๕๔๔
แคโทด	cathode	๒๐ ก.ย. ๒๕๔๔
เครื่องเรียงกระแสตรง	rectifier converter	๒๐ ก.ย. ๒๕๔๔
เครื่องเลเซอร์	laser	๒๐ ก.ย. ๒๕๔๔
เครื่องเลเซอร์ใช้แก๊ส	gas laser	๒๐ ก.ย. ๒๕๔๔
เครื่องเจียนด้วยเปลวไฟ	flame planing machine	๒๐ ก.ย. ๒๕๔๔
