-(พ่วง)ท้าย	trailer	๑๙ มิ.ย. ๒๕๔๔
CAT (computer-aided translation)	"ซีเอที (<a href=""/coinages/websearch.php?Wd=%A1%D2%C3%E1%BB%C5%C0%D2%C9%D2%E3%AA%E9%A4%CD%C1%BE%D4%C7%E0%B5%CD%C3%EC%AA%E8%C7%C2&amp;Sj=0"">การแปลภาษาใช้คอมพิวเตอร์ช่วย</a>) <i>[มีความหมายเหมือนกับ <a href=""/coinages/websearch.php?Wd=machine-aided+translation&amp;Sj=0"">machine-aided translation</a> (<a href=""/coinages/websearch.php?Wd=MAT&amp;Sj=0"">MAT</a>)]</i>"	๑๙ มิ.ย. ๒๕๔๔
CAT scan; computer-aided tomography	การกราดภาพตัดขวางใช้คอมพิวเตอร์ช่วย	๑๙ มิ.ย. ๒๕๔๔
catalog; catalogue	๑. สารบัญแฟ้ม<br/>๒. เข้าสารบัญแฟ้ม	๑๙ มิ.ย. ๒๕๔๔
catenate	เรียงต่อ	๑๙ มิ.ย. ๒๕๔๔
cathode ray tube (CRT)	"หลอดภาพ (<a href=""/coinages/websearch.php?Wd=%AB%D5%CD%D2%C3%EC%B7%D5&amp;Sj=0"">ซีอาร์ที</a>)"	๑๙ มิ.ย. ๒๕๔๔
CATV (cable television; cable TV; community antenna television)	"ซีเอทีวี (<a href=""/coinages/websearch.php?Wd=%E0%A4%E0%BA%D4%C5%B7%D5%C7%D5&amp;Sj=0"">เคเบิลทีวี</a>)"	๑๙ มิ.ย. ๒๕๔๔
CD (compact disc)	แผ่นซีดี	๑๙ มิ.ย. ๒๕๔๔
CD-ROM	ซีดีรอม	๑๙ มิ.ย. ๒๕๔๔
CDE (common desktop environment)	"ซีดีอี (<a href=""/coinages/websearch.php?Wd=%CA%D4%E8%A7%E1%C7%B4%C5%E9%CD%C1%E0%B4%CA%A1%EC%B7%E7%CD%BB%E1%BA%BA%CA%D2%C1%D1%AD&amp;Sj=0"">สิ่งแวดล้อมเดสก์ท็อปแบบสามัญ</a>)"	๑๙ มิ.ย. ๒๕๔๔
CCD (charge coupled device)	"ซีซีดี (<a href=""/coinages/websearch.php?Wd=%CD%D8%BB%A1%C3%B3%EC%B6%E8%D2%C2%E0%B7%BB%C3%D0%A8%D8&amp;Sj=0"">อุปกรณ์ถ่ายเทประจุ</a>)"	๑๙ มิ.ย. ๒๕๔๔
CCD memory	หน่วยความจำแบบซีซีดี	๑๙ มิ.ย. ๒๕๔๔
"<font class=""europe"">CCITT (<b>C</b>omité <b>C</b>onsultatif <b>I</b>nternationale de <b>T</b>élégraphique et <b>T</b>éléphonique; The International Telegraph and Telephone Consultative Committee)</font>"	"ซีซีไอทีที (<a href=""/coinages/websearch.php?Wd=%A4%B3%D0%A1%C3%C3%C1%A1%D2%C3%B7%D5%E8%BB%C3%D6%A1%C9%D2%A1%D2%C3%E2%B7%C3%E0%C5%A2%E1%C5%D0%E2%B7%C3%C8%D1%BE%B7%EC%C3%D0%CB%C7%E8%D2%A7%BB%C3%D0%E0%B7%C8&amp;Sj=0"">คณะกรรมการที่ปรึกษาการโทรเลขและโทรศัพท์ระหว่างประเทศ</a>)"	๑๙ มิ.ย. ๒๕๔๔
central justify	จัดกลาง	๑๙ มิ.ย. ๒๕๔๔
centralised data processing; centralized data processing	การประมวลผลข้อมูลแบบรวมศูนย์	๑๙ มิ.ย. ๒๕๔๔
centralised database; centralized database	ฐานข้อมูลแบบรวมศูนย์	๑๙ มิ.ย. ๒๕๔๔
centralized data processing; centralised data processing	การประมวลผลข้อมูลแบบรวมศูนย์	๑๙ มิ.ย. ๒๕๔๔
centralized database; centralised database	ฐานข้อมูลแบบรวมศูนย์	๑๙ มิ.ย. ๒๕๔๔
central processing unit (CPU)	"หน่วยประมวลผลกลาง (<a href=""/coinages/websearch.php?Wd=%AB%D5%BE%D5%C2%D9&amp;Sj=0"">ซีพียู</a>) <i>[มีความหมายเหมือนกับ <a href=""/coinages/websearch.php?Wd=central+processor&amp;Sj=0"">central processor</a>]</i>"	๑๙ มิ.ย. ๒๕๔๔
central processor	"ตัวประมวลผลกลาง <i>[มีความหมายเหมือนกับ <a href=""/coinages/websearch.php?Wd=central+processing+unit&amp;Sj=0"">central processing unit</a> (<a href=""/coinages/websearch.php?Wd=CPU&amp;Sj=0"">CPU</a>)]</i>"	๑๙ มิ.ย. ๒๕๔๔
CEO (chief executive officer)	"ซีอีโอ (<a href=""/coinages/websearch.php?Wd=%BB%C3%D0%B8%D2%B9%BA%C3%D4%CB%D2%C3&amp;Sj=0"">ประธานบริหาร</a>)"	๑๙ มิ.ย. ๒๕๔๔
ว่าง	null	๑๙ มิ.ย. ๒๕๔๔
ว่าง; ตัวว่าง; พื้นที่ว่าง; หน้าว่าง	blank	๑๙ มิ.ย. ๒๕๔๔
ว่าง; ทำให้ว่าง, ลบล้าง	clear	๑๙ มิ.ย. ๒๕๔๔
"<font class=""europe"">CERN (<b>C</b>onseil <b>E</b>uropéen pour la <b>R</b>echerche <b>N</b>ucléaire</font>)"	"เซิร์น (<a href=""/coinages/websearch.php?Wd=%C8%D9%B9%C2%EC%C7%D4%A8%D1%C2%B9%D4%C7%E0%A4%C5%D5%C2%C3%EC%C2%D8%E2%C3%BB&amp;Sj=0"">ศูนย์วิจัยนิวเคลียร์ยุโรป</a>)"	๑๙ มิ.ย. ๒๕๔๔
CGA (color graphics adapter)	"ซีจีเอ (<a href=""/coinages/websearch.php?Wd=%B5%D1%C7%BB%C3%D1%BA%C0%D2%BE%A1%C3%D2%BF%D4%A1%CA%EC%CA%D5&amp;Sj=0"">ตัวปรับภาพกราฟิกส์สี</a>)"	๑๙ มิ.ย. ๒๕๔๔
chain printer	เครื่องพิมพ์สายโซ่	๑๙ มิ.ย. ๒๕๔๔
chained file	แฟ้มลูกโซ่	๑๙ มิ.ย. ๒๕๔๔
chained list	รายการลูกโซ่	๑๙ มิ.ย. ๒๕๔๔
chaining search	การค้นหาแบบลูกโซ่	๑๙ มิ.ย. ๒๕๔๔
CGI (common gateway interface)	"ซีจีไอ (<a href=""/coinages/websearch.php?Wd=%E2%BB%C3%E1%A1%C3%C1%B5%E8%CD%BB%C3%D0%CA%D2%B9%C3%E8%C7%C1%CA%D3%CB%C3%D1%BA%E0%A1%B5%E0%C7%C2%EC&amp;Sj=0"">โปรแกรมต่อประสานร่วมสำหรับเกตเวย์</a>)"	๑๙ มิ.ย. ๒๕๔๔
chain	"๑. โยง<br/>๒. ลูกโซ่, <a href=""/coinages/websearch.php?Wd=%CA%D2%C2%E2%AB%E8&amp;Sj=0"">สายโซ่</a>"	๑๙ มิ.ย. ๒๕๔๔
chain code	รหัสลูกโซ่	๑๙ มิ.ย. ๒๕๔๔
change record	"ระเบียนเปลี่ยนแปลง <i>[มีความหมายเหมือนกับ <a href=""/coinages/websearch.php?Wd=transaction+record&amp;Sj=0"">transaction record</a>]</i>"	๑๙ มิ.ย. ๒๕๔๔
channel	"๑. ช่อง, <a href=""/coinages/websearch.php?Wd=%AA%E8%CD%A7%CA%D1%AD%AD%D2%B3&amp;Sj=0"">ช่องสัญญาณ</a><br/>๒. แชนเนล"	๑๙ มิ.ย. ๒๕๔๔
character	อักขระ	๑๙ มิ.ย. ๒๕๔๔
character code	รหัสอักขระ	๑๙ มิ.ย. ๒๕๔๔
channel service unit (CSU)	"หน่วยบริการช่องสื่อสาร (<a href=""/coinages/websearch.php?Wd=%AB%D5%E0%CD%CA%C2%D9&amp;Sj=0"">ซีเอสยู</a>)"	๑๙ มิ.ย. ๒๕๔๔
character density	ความหนาแน่นอักขระ	๑๙ มิ.ย. ๒๕๔๔
character mode	"ภาวะอักขระ <i>[มีความหมายเหมือนกับ <a href=""/coinages/websearch.php?Wd=alphanumeric+mode&amp;Sj=0"">alphanumeric mode</a> และ <a href=""/coinages/websearch.php?Wd=text+mode&amp;Sj=0"">text mode</a>]</i>"	๑๙ มิ.ย. ๒๕๔๔
character printer	เครื่องพิมพ์รายอักขระ	๑๙ มิ.ย. ๒๕๔๔
character reader	เครื่องอ่านอักขระ	๑๙ มิ.ย. ๒๕๔๔
character recognition	การรู้จำอักขระ	๑๙ มิ.ย. ๒๕๔๔
character set	ชุดอักขระ	๑๙ มิ.ย. ๒๕๔๔
charge coupled device (CCD)	"อุปกรณ์ถ่ายเทประจุ (<a href=""/coinages/websearch.php?Wd=%AB%D5%AB%D5%B4%D5&amp;Sj=0"">ซีซีดี</a>)"	๑๙ มิ.ย. ๒๕๔๔
characters per second (CPS)	"อักขระต่อวินาที (<a href=""/coinages/websearch.php?Wd=%AB%D5%BE%D5%E0%CD%CA&amp;Sj=0"">ซีพีเอส</a>)"	๑๙ มิ.ย. ๒๕๔๔
chat room	ห้องคุย	๑๙ มิ.ย. ๒๕๔๔
check digit	เลขโดดตรวจสอบ	๑๙ มิ.ย. ๒๕๔๔
check indicator	เครื่องชี้บอกการตรวจสอบ	๑๙ มิ.ย. ๒๕๔๔
check number	จำนวนตรวจสอบ	๑๙ มิ.ย. ๒๕๔๔
check problem	ปัญหาตรวจสอบ	๑๙ มิ.ย. ๒๕๔๔
check register	เรจิสเตอร์ตรวจสอบ	๑๙ มิ.ย. ๒๕๔๔
check solution	ผลเฉลยตรวจสอบ	๑๙ มิ.ย. ๒๕๔๔
check sum	ผลรวมตรวจสอบ	๑๙ มิ.ย. ๒๕๔๔
check symbol	สัญลักษณ์ตรวจสอบ	๑๙ มิ.ย. ๒๕๔๔
check word	คำตรวจสอบ	๑๙ มิ.ย. ๒๕๔๔
checkbox	กล่องเลือก	๑๙ มิ.ย. ๒๕๔๔
checking program	"โปรแกรมตรวจสอบ <i>[มีความหมายเหมือนกับ <a href=""/coinages/websearch.php?Wd=checking+routine&amp;Sj=0"">checking routine</a>]</i>"	๑๙ มิ.ย. ๒๕๔๔
checking routine	"รูทีนตรวจสอบ <i>[มีความหมายเหมือนกับ <a href=""/coinages/websearch.php?Wd=checking+program&amp;Sj=0"">checking program</a>]</i>"	๑๙ มิ.ย. ๒๕๔๔
checkout	การหาจุดบกพร่อง	๑๙ มิ.ย. ๒๕๔๔
checkpoint	จุดตรวจสอบ	๑๙ มิ.ย. ๒๕๔๔
check	การตรวจสอบ	๑๙ มิ.ย. ๒๕๔๔
check bit	บิตตรวจสอบ	๑๙ มิ.ย. ๒๕๔๔
check character	"อักขระตรวจสอบ <i>[มีความหมายเหมือนกับ <a href=""/coinages/websearch.php?Wd=redundant+character&amp;Sj=0"">redundant character</a>]</i>"	๑๙ มิ.ย. ๒๕๔๔
chief programmer team	ทีมงานนักเขียนโปรแกรมหลัก	๑๙ มิ.ย. ๒๕๔๔
chief executive officer (CEO)	"ประธานบริหาร (<a href=""/coinages/websearch.php?Wd=%AB%D5%CD%D5%E2%CD&amp;Sj=0"">ซีอีโอ</a>)"	๑๙ มิ.ย. ๒๕๔๔
chief information officer (CIO)	"ประธานฝ่ายสารสนเทศ (<a href=""/coinages/websearch.php?Wd=%AB%D5%E4%CD%E2%CD&amp;Sj=0"">ซีไอโอ</a>)"	๑๙ มิ.ย. ๒๕๔๔
child node	บัพลูก	๑๙ มิ.ย. ๒๕๔๔
chip	ชิป	๑๙ มิ.ย. ๒๕๔๔
Chomsky hierarchy	ลำดับชั้นชอมสกี	๑๙ มิ.ย. ๒๕๔๔
Chomsky normal form	รูปแบบบรรทัดฐานชอมสกี	๑๙ มิ.ย. ๒๕๔๔
Church’s thesis	แนวคิดหลักของเชิร์ช	๑๙ มิ.ย. ๒๕๔๔
CHRP (common hardware reference platform)	"ซีเอชอาร์พี (<a href=""/coinages/websearch.php?Wd=%E1%BE%C5%B5%BF%CD%C3%EC%C1%CD%E9%D2%A7%CD%D4%A7%C3%E8%C7%C1%A2%CD%A7%CE%D2%C3%EC%B4%E1%C7%C3%EC&amp;Sj=0"">แพลตฟอร์มอ้างอิงร่วมของฮาร์ดแวร์</a>)"	๑๙ มิ.ย. ๒๕๔๔
วอร์ม (เขียนหนึ่งอ่านหลายครั้ง)	"WORM (<a href=""/coinages/websearch.php?Wd=write+once+read+many&amp;Sj=0"">write once read many</a>)"	๑๙ มิ.ย. ๒๕๔๔
CICS (customer information control system)	"ซีไอซีเอส (<a href=""/coinages/websearch.php?Wd=%C3%D0%BA%BA%A4%C7%BA%A4%D8%C1%CA%D2%C3%CA%B9%E0%B7%C8%C5%D9%A1%A4%E9%D2&amp;Sj=0"">ระบบควบคุมสารสนเทศลูกค้า</a>)"	๑๙ มิ.ย. ๒๕๔๔
CIM (computer input from microfilm)	"ซีไอเอ็ม (<a href=""/coinages/websearch.php?Wd=%E4%C1%E2%A4%C3%BF%D4%C5%EC%C1%CA%D9%E8%A4%CD%C1%BE%D4%C7%E0%B5%CD%C3%EC&amp;Sj=0"">ไมโครฟิล์มสู่คอมพิวเตอร์</a>)"	๑๙ มิ.ย. ๒๕๔๔
CIM (computer integrated manufacturing)	"ซีไอเอ็ม (<a href=""/coinages/websearch.php?Wd=%A1%D2%C3%BC%C5%D4%B5%E1%BA%BA%BC%CA%C1%BC%CA%D2%B9%B4%E9%C7%C2%A4%CD%C1%BE%D4%C7%E0%B5%CD%C3%EC&amp;Sj=0"">การผลิตแบบผสมผสานด้วยคอมพิวเตอร์</a>)"	๑๙ มิ.ย. ๒๕๔๔
CIO (chief information officer)	"ซีไอโอ (<a href=""/coinages/websearch.php?Wd=%BB%C3%D0%B8%D2%B9%BD%E8%D2%C2%CA%D2%C3%CA%B9%E0%B7%C8&amp;Sj=0"">ประธานฝ่ายสารสนเทศ</a>)"	๑๙ มิ.ย. ๒๕๔๔
circular list	รายการแบบวงกลม	๑๙ มิ.ย. ๒๕๔๔
circular shift; cycle shift	"การเลื่อนเป็นวง <i>[มีความหมายเหมือนกับ <a href=""/coinages/websearch.php?Wd=cyclic+shift&amp;Sj=0"">cyclic shift</a>]</i>"	๑๙ มิ.ย. ๒๕๔๔
circulating register	เรจิสเตอร์หมุนเวียน	๑๙ มิ.ย. ๒๕๔๔
clamping circuit	วงจรแคลมป์	๑๙ มิ.ย. ๒๕๔๔
class	คลาส <i>[ใช้ในภาษาเชิงวัตถุ]</i>	๑๙ มิ.ย. ๒๕๔๔
clear	"๑. ลบล้าง, <a href=""/coinages/websearch.php?Wd=%B7%D3%E3%CB%E9%C7%E8%D2%A7&amp;Sj=0"">ทำให้ว่าง</a><br/>๒. ว่าง"	๑๙ มิ.ย. ๒๕๔๔
clear band	แถบว่าง	๑๙ มิ.ย. ๒๕๔๔
click	(กด)คลิก	๑๙ มิ.ย. ๒๕๔๔
client-server system	ระบบรับ-ให้บริการ	๑๙ มิ.ย. ๒๕๔๔
clip	"๑. เล็ม, <a href=""/coinages/websearch.php?Wd=%A2%C3%D4%BA&amp;Sj=0"">ขริบ</a><br/>๒. สิ่งบันทึก"	๑๙ มิ.ย. ๒๕๔๔
clip art	กฤตศิลป์	๑๙ มิ.ย. ๒๕๔๔
clipboard	คลิปบอร์ด	๑๙ มิ.ย. ๒๕๔๔
clipping	"๑. การเล็ม, <a href=""/coinages/websearch.php?Wd=%A1%D2%C3%A2%C3%D4%BA&amp;Sj=0"">การขริบ</a><br/>๒. ส่วนตัด"	๑๙ มิ.ย. ๒๕๔๔
clock	นาฬิกา	๑๙ มิ.ย. ๒๕๔๔
clock rate	อัตราสัญญาณนาฬิกา	๑๙ มิ.ย. ๒๕๔๔
clock signal	สัญญาณนาฬิกา	๑๙ มิ.ย. ๒๕๔๔
clock track	ร่องสัญญาณนาฬิกา	๑๙ มิ.ย. ๒๕๔๔
closed loop	"๑. วงวนปิด<br/>๒. วงวนไม่รู้จบ <i>[มีความหมายเหมือนกับ <a href=""/coinages/websearch.php?Wd=infinite+loop&amp;Sj=0"">infinite loop</a>]</i>"	๑๙ มิ.ย. ๒๕๔๔
closed subroutine	ซับรูทีนแบบปิด	๑๙ มิ.ย. ๒๕๔๔
closed shop	ห้องปฏิบัติงานแบบปิด	๑๙ มิ.ย. ๒๕๔๔
cluster	กลุ่ม	๑๙ มิ.ย. ๒๕๔๔
clustered file	แฟ้มเข้ากลุ่ม	๑๙ มิ.ย. ๒๕๔๔
CMIP (Common Management Information Protocol)	"ซีเอ็มไอพี (<a href=""/coinages/websearch.php?Wd=%E0%A1%B3%B1%EC%C7%D4%B8%D5%A8%D1%B4%A1%D2%C3%CA%D2%C3%CA%B9%E0%B7%C8%C3%E8%C7%C1&amp;Sj=0"">เกณฑ์วิธีจัดการสารสนเทศร่วม</a>)"	๑๙ มิ.ย. ๒๕๔๔
วัฏจักร, รอบ, วง	cycle	๑๙ มิ.ย. ๒๕๔๔
วีแรม (แรมภาพ)	"VRAM (<a href=""/coinages/websearch.php?Wd=video+RAM&amp;Sj=0"">video RAM</a>)"	๑๙ มิ.ย. ๒๕๔๔
วาร์ (ผู้ขายสินค้ามูลค่าเพิ่ม)	"VAR (<a href=""/coinages/websearch.php?Wd=value+added+reseller&amp;Sj=0"">value added reseller</a>)"	๑๙ มิ.ย. ๒๕๔๔
วีแอลเอสไอ (วงจรรวมความจุสูงมาก)	"VLSI (<a href=""/coinages/websearch.php?Wd=very+large+scale+integration&amp;Sj=0"">very large scale integration</a>)"	๑๙ มิ.ย. ๒๕๔๔
วิภัช, แจง, แจงส่วน	parse	๑๙ มิ.ย. ๒๕๔๔
coax; coaxial cable	สายโคแอกซ์	๑๙ มิ.ย. ๒๕๔๔
วีแซม (วิธีเข้าถึงหน่วยเก็บเสมือน)	"VSAM (<a href=""/coinages/websearch.php?Wd=virtual+storage+access+method&amp;Sj=0"">virtual storage access method</a>)"	๑๙ มิ.ย. ๒๕๔๔
COBOL (<b>C</b>ommon <b>B</b>usiness <b>O</b>riented <b>L</b>anguage)	(ภาษา)โคบอล	๑๙ มิ.ย. ๒๕๔๔
code	"๑. รหัส, <a href=""/coinages/websearch.php?Wd=%C3%CB%D1%CA%A4%D3%CA%D1%E8%A7&amp;Sj=0"">รหัสคำสั่ง</a> <i>[สัญลักษณ์ที่ใช้แทนข้อมูลหรือคำสั่ง]</i><br/>๒. คำสั่ง, <a href=""/coinages/websearch.php?Wd=%E2%BB%C3%E1%A1%C3%C1&amp;Sj=0"">โปรแกรม</a><br/>๓. ลงรหัส<br/>๔. เขียนโปรแกรม"	๑๙ มิ.ย. ๒๕๔๔
วิศวกรรมระบบ	system engineering	๑๙ มิ.ย. ๒๕๔๔
วิศวกรรมระบบใช้คอมพิวเตอร์ช่วย (เคส)	"computer-aided system engineering (<a href=""/coinages/websearch.php?Wd=CASE&amp;Sj=0"">CASE</a>)"	๑๙ มิ.ย. ๒๕๔๔
วิศวกรรมส่วนชุดคำสั่ง, วิศวกรรมซอฟต์แวร์	software engineering	๑๙ มิ.ย. ๒๕๔๔
วิศวกรรมสารสนเทศ	information engineering	๑๙ มิ.ย. ๒๕๔๔
วิศวกรรมความรู้	knowledge engineering	๑๙ มิ.ย. ๒๕๔๔
วิศวกรรมคอมพิวเตอร์	computer engineering	๑๙ มิ.ย. ๒๕๔๔
code segment	ส่วนเก็บคำสั่ง	๑๙ มิ.ย. ๒๕๔๔
coder	๑. ตัวลงรหัส<br/>๒. ผู้ลงรหัส	๑๙ มิ.ย. ๒๕๔๔
coding sheet	ใบลงรหัสคำสั่ง	๑๙ มิ.ย. ๒๕๔๔
วิศวกรรมซอฟต์แวร์, วิศวกรรมส่วนชุดคำสั่ง	software engineering	๑๙ มิ.ย. ๒๕๔๔
วิศวกรรมซอฟต์แวร์ใช้คอมพิวเตอร์ช่วย (เคส)	"computer-aided software engineering (<a href=""/coinages/websearch.php?Wd=CASE&amp;Sj=0"">CASE</a>)"	๑๙ มิ.ย. ๒๕๔๔
วิศวกรระบบ	system engineer	๑๙ มิ.ย. ๒๕๔๔
(ภาษา)วีอาร์เอ็มแอล	"VRML (<a href=""/coinages/websearch.php?Wd=Virtual+Reality+Modeling+Language&amp;Sj=0""><b>V</b>irtual <b>R</b>eality <b>M</b>odeling <b>L</b>anguage</a>)"	๑๙ มิ.ย. ๒๕๔๔
วีอาร์ซี (การตรวจสอบด้วยส่วนซ้ำซ้อนแนวตั้ง)	"VRC (<a href=""/coinages/websearch.php?Wd=vertical+redundancy+check&amp;Sj=0"">vertical redundancy check</a>)"	๑๙ มิ.ย. ๒๕๔๔
cold start	เปิดเครื่อง	๑๙ มิ.ย. ๒๕๔๔
collaborator	ผู้ร่วมงาน	๑๙ มิ.ย. ๒๕๔๔
collate	รวมแฟ้มเรียง	๑๙ มิ.ย. ๒๕๔๔
color graphics adapter (CGA)	"ตัวปรับภาพกราฟิกส์สี (<a href=""/coinages/websearch.php?Wd=%AB%D5%A8%D5%E0%CD&amp;Sj=0"">ซีจีเอ</a>)"	๑๙ มิ.ย. ๒๕๔๔
column	"สดมภ์, <a href=""/coinages/websearch.php?Wd=%E1%B9%C7%B5%D1%E9%A7&amp;Sj=0"">แนวตั้ง</a>"	๑๙ มิ.ย. ๒๕๔๔
column-binary	เลขฐานสองแนวตั้ง	๑๙ มิ.ย. ๒๕๔๔
column-major order	อันดับเรียงตามสดมภ์	๑๙ มิ.ย. ๒๕๔๔
COM (component object model)	"คอม (<a href=""/coinages/websearch.php?Wd=%E1%BA%BA%A8%D3%C5%CD%A7%CD%E7%CD%BA%E0%A8%A1%B5%EC%C2%E8%CD%C2&amp;Sj=0"">แบบจำลองอ็อบเจกต์ย่อย</a>)"	๑๙ มิ.ย. ๒๕๔๔
COM (computer output on microfilm)	"ซีโอเอ็ม, <a href=""/coinages/websearch.php?Wd=%A4%CD%C1&amp;Sj=0"">คอม</a> (<a href=""/coinages/websearch.php?Wd=%E4%C1%E2%A4%C3%BF%D4%C5%EC%C1%A8%D2%A1%A4%CD%C1%BE%D4%C7%E0%B5%CD%C3%EC&amp;Sj=0"">ไมโครฟิล์มจากคอมพิวเตอร์</a>)"	๑๙ มิ.ย. ๒๕๔๔
combinational circuit	๑. วงจรเชิงผสม<br/>๒. วงจรไร้ความจำ	๑๙ มิ.ย. ๒๕๔๔
combinational logic element	ส่วนตรรกะเชิงผสม	๑๙ มิ.ย. ๒๕๔๔
combinational machine	เครื่องเชิงผสม	๑๙ มิ.ย. ๒๕๔๔
"<font class=""europe"">Comité Consultatif Internationale de Télégraphique et Téléphonique; The International Telegraph and Telephone Consultative Committee (CCITT)</font>"	"คณะกรรมการที่ปรึกษาการโทรเลขและโทรศัพท์ระหว่างประเทศ (<a href=""/coinages/websearch.php?Wd=%AB%D5%AB%D5%E4%CD%B7%D5%B7%D5&amp;Sj=0"">ซีซีไอทีที</a>)"	๑๙ มิ.ย. ๒๕๔๔
command	คำสั่งงาน	๑๙ มิ.ย. ๒๕๔๔
command interpreter	โปรแกรมแปลคำสั่งงาน	๑๙ มิ.ย. ๒๕๔๔
command-line interface	ส่วนต่อประสานรายคำสั่ง	๑๙ มิ.ย. ๒๕๔๔
comment	หมายเหตุ	๑๙ มิ.ย. ๒๕๔๔
commercial language	ภาษาเชิงพาณิชย์	๑๙ มิ.ย. ๒๕๔๔
common area	พื้นที่ร่วม	๑๙ มิ.ย. ๒๕๔๔
common gateway interface (CGI)	"โปรแกรมต่อประสานร่วมสำหรับเกตเวย์ (<a href=""/coinages/websearch.php?Wd=%AB%D5%A8%D5%E4%CD&amp;Sj=0"">ซีจีไอ</a>)"	๑๙ มิ.ย. ๒๕๔๔
common hardware reference platform (CHRP)	"แพลตฟอร์มอ้างอิงร่วมของฮาร์ดแวร์ (<a href=""/coinages/websearch.php?Wd=%AB%D5%E0%CD%AA%CD%D2%C3%EC%BE%D5&amp;Sj=0"">ซีเอชอาร์พี</a>)"	๑๙ มิ.ย. ๒๕๔๔
common language	ภาษาร่วม	๑๙ มิ.ย. ๒๕๔๔
Common Management Information Protocol (CMIP)	"เกณฑ์วิธีจัดการสารสนเทศร่วม (<a href=""/coinages/websearch.php?Wd=%AB%D5%E0%CD%E7%C1%E4%CD%BE%D5&amp;Sj=0"">ซีเอ็มไอพี</a>)"	๑๙ มิ.ย. ๒๕๔๔
common desktop environment (CDE)	"สิ่งแวดล้อมเดสก์ท็อปแบบสามัญ (<a href=""/coinages/websearch.php?Wd=%AB%D5%B4%D5%CD%D5&amp;Sj=0"">ซีดีอี</a>)"	๑๙ มิ.ย. ๒๕๔๔
Common Object Request Broker Architecture (CORBA)	"สถาปัตยกรรมตัวจัดหาอ็อบเจกต์ร่วมตามคำขอ (<a href=""/coinages/websearch.php?Wd=%A4%CD%C3%EC%BA%D2&amp;Sj=0"">คอร์บา</a>)"	๑๙ มิ.ย. ๒๕๔๔
common programming interface for communications (CPI-C)	"ตัวต่อประสานการโปรแกรมร่วมสำหรับการสื่อสาร (<a href=""/coinages/websearch.php?Wd=%AB%D5%BE%D5%E4%CD%AB%D5&amp;Sj=0"">ซีพีไอซี</a>)"	๑๙ มิ.ย. ๒๕๔๔
common storage area	พื้นที่หน่วยเก็บร่วม	๑๙ มิ.ย. ๒๕๔๔
communication channel	ช่องสื่อสาร	๑๙ มิ.ย. ๒๕๔๔
community antenna television; cable television; cable TV (CATV)	"เคเบิลทีวี (<a href=""/coinages/websearch.php?Wd=%AB%D5%E0%CD%B7%D5%C7%D5&amp;Sj=0"">ซีเอทีวี</a>)"	๑๙ มิ.ย. ๒๕๔๔
communication device	อุปกรณ์สื่อสาร	๑๙ มิ.ย. ๒๕๔๔
compact disc (CD)	แผ่นซีดี	๑๙ มิ.ย. ๒๕๔๔
compaction	การอัดแน่น	๑๙ มิ.ย. ๒๕๔๔
compatibility	"ความเข้ากันได้, <a href=""/coinages/websearch.php?Wd=%A4%C7%D2%C1%E3%AA%E9%E1%B7%B9%A1%D1%B9%E4%B4%E9&amp;Sj=0"">ความใช้แทนกันได้</a>"	๑๙ มิ.ย. ๒๕๔๔
compatible	"๑. เข้ากันได้, <a href=""/coinages/websearch.php?Wd=%E3%AA%E9%E1%B7%B9%A1%D1%B9%E4%B4%E9&amp;Sj=0"">ใช้แทนกันได้</a><br/>๒. แบบเดียวกับ"	๑๙ มิ.ย. ๒๕๔๔
comparator	อุปกรณ์เปรียบเทียบ	๑๙ มิ.ย. ๒๕๔๔
compartmentalisation; compartmentalization; compartmentation	การแบ่งเป็นส่วน	๑๙ มิ.ย. ๒๕๔๔
