-(พ่วง)ท้าย	trailer	๑๙ มิ.ย. ๒๕๔๔
VAN (value added network)	"แวน (<a href=""/coinages/websearch.php?Wd=%A2%E8%D2%C2%A7%D2%B9%C1%D9%C5%A4%E8%D2%E0%BE%D4%E8%C1&amp;Sj=0"">ข่ายงานมูลค่าเพิ่ม</a>, <a href=""/coinages/websearch.php?Wd=%A2%E8%D2%C2%A7%D2%B9%A4%D8%B3%A4%E8%D2%E0%BE%D4%E8%C1&amp;Sj=0"">ข่ายงานคุณค่าเพิ่ม</a>)"	๑๙ มิ.ย. ๒๕๔๔
vaporware	เวเพอร์แวร์	๑๙ มิ.ย. ๒๕๔๔
variable address	"เลขที่อยู่แปรได้ <i>[มีความหมายเหมือนกับ <a href=""/coinages/websearch.php?Wd=indexed+address&amp;Sj=0"">indexed address</a>]</i>"	๑๙ มิ.ย. ๒๕๔๔
variable length block	กลุ่มระเบียนความยาวแปรได้	๑๙ มิ.ย. ๒๕๔๔
variable length field	เขตข้อมูลความยาวแปรได้	๑๙ มิ.ย. ๒๕๔๔
variable length record	ระเบียนความยาวแปรได้	๑๙ มิ.ย. ๒๕๔๔
VAR (value added reseller)	"วาร์ (<a href=""/coinages/websearch.php?Wd=%BC%D9%E9%A2%D2%C2%CA%D4%B9%A4%E9%D2%C1%D9%C5%A4%E8%D2%E0%BE%D4%E8%C1&amp;Sj=0"">ผู้ขายสินค้ามูลค่าเพิ่ม</a>)"	๑๙ มิ.ย. ๒๕๔๔
variable	ตัวแปร	๑๙ มิ.ย. ๒๕๔๔
VDSL (very-high-speed ADSL)	"วีดีเอสแอล (<a href=""/coinages/websearch.php?Wd=%E0%CD%B4%D5%E0%CD%CA%E1%CD%C5%A4%C7%D2%C1%E0%C3%E7%C7%CA%D9%A7%C1%D2%A1&amp;Sj=0"">เอดีเอสแอลความเร็วสูงมาก</a>)"	๑๙ มิ.ย. ๒๕๔๔
VDU (video display unit)	"วีดียู (<a href=""/coinages/websearch.php?Wd=%A8%CD%C0%D2%BE&amp;Sj=0"">จอภาพ</a>) <i>[มีความหมายเหมือนกับ <a href=""/coinages/websearch.php?Wd=monitor&amp;Sj=0"">monitor</a> ๑]</i>"	๑๙ มิ.ย. ๒๕๔๔
verification	การทวนสอบ	๑๙ มิ.ย. ๒๕๔๔
verifier	เครื่องทวนสอบ	๑๙ มิ.ย. ๒๕๔๔
verify	ทวนสอบ	๑๙ มิ.ย. ๒๕๔๔
version	๑. รุ่น<br/>๒. แบบ<br/>๓. ฉบับ<br/>๔. ชุด	๑๙ มิ.ย. ๒๕๔๔
vertex	จุดยอด	๑๙ มิ.ย. ๒๕๔๔
very large scale integration (VLSI)	"วงจรรวมความจุสูงมาก (<a href=""/coinages/websearch.php?Wd=%C7%D5%E1%CD%C5%E0%CD%CA%E4%CD&amp;Sj=0"">วีแอลเอสไอ</a>)"	๑๙ มิ.ย. ๒๕๔๔
very-high-speed ADSL (VDSL)	"เอดีเอสแอลความเร็วสูงมาก (<a href=""/coinages/websearch.php?Wd=%C7%D5%B4%D5%E0%CD%CA%E1%CD%C5&amp;Sj=0"">วีดีเอสแอล</a>)"	๑๙ มิ.ย. ๒๕๔๔
vertical redundancy check (VRC)	"การตรวจสอบด้วยส่วนซ้ำซ้อนแนวตั้ง (<a href=""/coinages/websearch.php?Wd=%C7%D5%CD%D2%C3%EC%AB%D5&amp;Sj=0"">วีอาร์ซี</a>)"	๑๙ มิ.ย. ๒๕๔๔
VGA (video graphics array)	"วีจีเอ (<a href=""/coinages/websearch.php?Wd=%A2%BA%C7%B9%BB%C3%D1%BA%C0%D2%BE%E1%BA%BA%C7%D5%B4%D4%B7%D1%C8%B9%EC&amp;Sj=0"">ขบวนปรับภาพแบบวีดิทัศน์</a>)"	๑๙ มิ.ย. ๒๕๔๔
video	๑. วีดิทัศน์<br/>๒. -ภาพ	๑๙ มิ.ย. ๒๕๔๔
video adapter	ตัวปรับภาพ	๑๙ มิ.ย. ๒๕๔๔
video board; video graphics board	"แผ่นวงจรภาพกราฟิกส์ <i>[มีความหมายเหมือนกับ <a href=""/coinages/websearch.php?Wd=graphics+adapter&amp;Sj=0"">graphics adapter</a>]</i>"	๑๙ มิ.ย. ๒๕๔๔
video buffer	บัฟเฟอร์ภาพ	๑๙ มิ.ย. ๒๕๔๔
video card	แผ่นวงจรภาพ	๑๙ มิ.ย. ๒๕๔๔
video digitiser; video digitizer	ตัวแปลงภาพเป็นดิจิทัล	๑๙ มิ.ย. ๒๕๔๔
video digitiser; video digitizer	ตัวแปลงภาพเป็นดิจิทัล	๑๙ มิ.ย. ๒๕๔๔
video display unit (VDU)	"จอภาพ (<a href=""/coinages/websearch.php?Wd=%C7%D5%B4%D5%C2%D9&amp;Sj=0"">วีดียู</a>) <i>[มีความหมายเหมือนกับ <a href=""/coinages/websearch.php?Wd=monitor&amp;Sj=0"">monitor</a> ๑]</i>"	๑๙ มิ.ย. ๒๕๔๔
video graphics array (VGA)	"ขบวนปรับภาพแบบวีดิทัศน์ (<a href=""/coinages/websearch.php?Wd=%C7%D5%A8%D5%E0%CD&amp;Sj=0"">วีจีเอ</a>)"	๑๙ มิ.ย. ๒๕๔๔
video graphics board; video board	"แผ่นวงจรภาพกราฟิกส์ <i>[มีความหมายเหมือนกับ <a href=""/coinages/websearch.php?Wd=graphics+adapter&amp;Sj=0"">graphics adapter</a>]</i>"	๑๙ มิ.ย. ๒๕๔๔
video memory	หน่วยความจำภาพ	๑๙ มิ.ย. ๒๕๔๔
video mode	ภาวะภาพ	๑๙ มิ.ย. ๒๕๔๔
video RAM (VRAM)	"แรมภาพ (<a href=""/coinages/websearch.php?Wd=%C7%D5%E1%C3%C1&amp;Sj=0"">วีแรม</a>)"	๑๙ มิ.ย. ๒๕๔๔
video signal	สัญญาณภาพ	๑๙ มิ.ย. ๒๕๔๔
videoconference	การประชุมทางวีดิทัศน์	๑๙ มิ.ย. ๒๕๔๔
videodisc	แผ่นวีดิทัศน์	๑๙ มิ.ย. ๒๕๔๔
videoteleconference	การประชุมทางไกลโดยวีดิทัศน์	๑๙ มิ.ย. ๒๕๔๔
videotex	วีดิสาร	๑๙ มิ.ย. ๒๕๔๔
view	ทรรศนะ	๑๙ มิ.ย. ๒๕๔๔
viewer	ผู้ชม	๑๙ มิ.ย. ๒๕๔๔
viewpoint	มุมมอง	๑๙ มิ.ย. ๒๕๔๔
virtual	เสมือน	๑๙ มิ.ย. ๒๕๔๔
virtual address	เลขที่อยู่เสมือน	๑๙ มิ.ย. ๒๕๔๔
virtual machine	เครื่องเสมือน	๑๙ มิ.ย. ๒๕๔๔
virtual memory	หน่วยความจำเสมือน	๑๙ มิ.ย. ๒๕๔๔
virtual peripheral	อุปกรณ์รอบข้างเสมือน	๑๙ มิ.ย. ๒๕๔๔
virtual reality	ความเป็นจริงเสมือน	๑๙ มิ.ย. ๒๕๔๔
virtual storage	หน่วยเก็บเสมือน	๑๙ มิ.ย. ๒๕๔๔
virtual storage access method (VSAM)	"วิธีเข้าถึงหน่วยเก็บเสมือน (<a href=""/coinages/websearch.php?Wd=%C7%D5%E1%AB%C1&amp;Sj=0"">วีแซม</a>)"	๑๙ มิ.ย. ๒๕๔๔
virtual world	โลกเสมือน	๑๙ มิ.ย. ๒๕๔๔
virus	ไวรัส	๑๙ มิ.ย. ๒๕๔๔
visual language	ภาษาภาพ	๑๙ มิ.ย. ๒๕๔๔
visualisation; visualization	การสร้างภาพนามธรรม	๑๙ มิ.ย. ๒๕๔๔
visit	เยี่ยมชม	๑๙ มิ.ย. ๒๕๔๔
VLSI (very large scale integration)	"วีแอลเอสไอ (<a href=""/coinages/websearch.php?Wd=%C7%A7%A8%C3%C3%C7%C1%A4%C7%D2%C1%A8%D8%CA%D9%A7%C1%D2%A1&amp;Sj=0"">วงจรรวมความจุสูงมาก</a>)"	๑๙ มิ.ย. ๒๕๔๔
voice recognition	การรู้จำเสียงพูด	๑๙ มิ.ย. ๒๕๔๔
voice-grade channel	ช่องสัญญาณช่วงระดับเสียงพูด	๑๙ มิ.ย. ๒๕๔๔
voice-grade line	สายสัญญาณช่วงระดับเสียงพูด	๑๙ มิ.ย. ๒๕๔๔
voice	เสียง(พูด)	๑๙ มิ.ย. ๒๕๔๔
voice answer back (VAB)	"การตอบกลับด้วยเสียงพูด (<a href=""/coinages/websearch.php?Wd=%E1%C7%E7%BA&amp;Sj=0"">แว็บ</a>)"	๑๙ มิ.ย. ๒๕๔๔
voice coil	ขดลวดเสียง	๑๙ มิ.ย. ๒๕๔๔
voice mail	ไปรษณีย์เสียง	๑๙ มิ.ย. ๒๕๔๔
void	"ด่าง, <a href=""/coinages/websearch.php?Wd=%A8%D8%B4%B4%E8%D2%A7&amp;Sj=0"">จุดด่าง</a> <i>[ใช้กับรหัสแท่ง]</i>"	๑๙ มิ.ย. ๒๕๔๔
volatile	ลบเลือนได้	๑๙ มิ.ย. ๒๕๔๔
volatile memory	หน่วยความจำลบเลือนได้	๑๙ มิ.ย. ๒๕๔๔
volatile storage	หน่วยเก็บลบเลือนได้	๑๙ มิ.ย. ๒๕๔๔
voltage regulator	ตัวคุมค่าแรงดัน	๑๙ มิ.ย. ๒๕๔๔
volume	๑. หมวด<br/>๒. ปริมาตร	๑๙ มิ.ย. ๒๕๔๔
volume label	ป้ายหมวด	๑๙ มิ.ย. ๒๕๔๔
von Neumann architecture	สถาปัตยกรรมฟอนนอยมันน์	๑๙ มิ.ย. ๒๕๔๔
VRAM (video RAM)	"วีแรม (<a href=""/coinages/websearch.php?Wd=%E1%C3%C1%C0%D2%BE&amp;Sj=0"">แรมภาพ</a>)"	๑๙ มิ.ย. ๒๕๔๔
VRC (vertical redundancy check)	"วีอาร์ซี (<a href=""/coinages/websearch.php?Wd=%A1%D2%C3%B5%C3%C7%A8%CA%CD%BA%B4%E9%C7%C2%CA%E8%C7%B9%AB%E9%D3%AB%E9%CD%B9%E1%B9%C7%B5%D1%E9%A7&amp;Sj=0"">การตรวจสอบด้วยส่วนซ้ำซ้อนแนวตั้ง</a>)"	๑๙ มิ.ย. ๒๕๔๔
VRML (<b>V</b>irtual <b>R</b>eality <b>M</b>odeling <b>L</b>anguage)	(ภาษา)วีอาร์เอ็มแอล	๑๙ มิ.ย. ๒๕๔๔
VSAM (virtual storage access method)	"วีแซม (<a href=""/coinages/websearch.php?Wd=%C7%D4%B8%D5%E0%A2%E9%D2%B6%D6%A7%CB%B9%E8%C7%C2%E0%A1%E7%BA%E0%CA%C1%D7%CD%B9&amp;Sj=0"">วิธีเข้าถึงหน่วยเก็บเสมือน</a>)"	๑๙ มิ.ย. ๒๕๔๔
wafer	แว่นผลึก	๑๙ มิ.ย. ๒๕๔๔
wafer fabrication	การผลิตแว่นผลึก	๑๙ มิ.ย. ๒๕๔๔
WAIS (wide area information service)	"เวส์ (<a href=""/coinages/websearch.php?Wd=%BA%C3%D4%A1%D2%C3%CA%D2%C3%CA%B9%E0%B7%C8%BA%C3%D4%E0%C7%B3%A1%C7%E9%D2%A7&amp;Sj=0"">บริการสารสนเทศบริเวณกว้าง</a>)"	๑๙ มิ.ย. ๒๕๔๔
wait	รอ	๑๙ มิ.ย. ๒๕๔๔
wait state	ภาวะรอ	๑๙ มิ.ย. ๒๕๔๔
wait time	"เวลารอ, <a href=""/coinages/websearch.php?Wd=%AA%E8%C7%A7%E0%C7%C5%D2%C3%CD&amp;Sj=0"">ช่วงเวลารอ</a>"	๑๙ มิ.ย. ๒๕๔๔
WAN (wide area network)	"แวน (<a href=""/coinages/websearch.php?Wd=%A2%E8%D2%C2%A7%D2%B9%BA%C3%D4%E0%C7%B3%A1%C7%E9%D2%A7&amp;Sj=0"">ข่ายงานบริเวณกว้าง</a>)"	๑๙ มิ.ย. ๒๕๔๔
walk through	ตรวจตลอด	๑๙ มิ.ย. ๒๕๔๔
walkthrough	การตรวจตลอด	๑๙ มิ.ย. ๒๕๔๔
warranty	การรับประกัน	๑๙ มิ.ย. ๒๕๔๔
warm start	เริ่มเครื่องใหม่	๑๙ มิ.ย. ๒๕๔๔
web page	เว็บเพจ	๑๙ มิ.ย. ๒๕๔๔
web server	"ตัวบริการเว็บ, <a href=""/coinages/websearch.php?Wd=%E0%A4%C3%D7%E8%CD%A7%BA%C3%D4%A1%D2%C3%E0%C7%E7%BA&amp;Sj=0"">เครื่องบริการเว็บ</a>"	๑๙ มิ.ย. ๒๕๔๔
web site	"ที่อยู่เว็บ, <a href=""/coinages/websearch.php?Wd=%E0%C7%E7%BA%E4%AB%B5%EC&amp;Sj=0"">เว็บไซต์</a>"	๑๙ มิ.ย. ๒๕๔๔
Web; World Wide Web (WWW)	เว็บ, เวิลด์ไวด์เว็บ	๑๙ มิ.ย. ๒๕๔๔
web browser	"โปรแกรมค้นดูเว็บ, <a href=""/coinages/websearch.php?Wd=%E0%C7%E7%BA%E0%BA%C3%D2%C7%EC%E0%AB%CD%C3%EC&amp;Sj=0"">เว็บเบราว์เซอร์</a>"	๑๙ มิ.ย. ๒๕๔๔
web master	ผู้ดูแลเว็บ	๑๙ มิ.ย. ๒๕๔๔
what you see is what you get (WYSIWYG)	"ได้อย่างที่เห็น (<a href=""/coinages/websearch.php?Wd=%C7%D4%AB%D4%C7%D4%A1&amp;Sj=0"">วิซิวิก</a><a href=""/coinages/websearch.php?Wd=&amp;Sj=0"">)</a>"	๑๙ มิ.ย. ๒๕๔๔
wheel printer	เครื่องพิมพ์แบบจาน	๑๙ มิ.ย. ๒๕๔๔
Whetstone benchmark	การวัดเปรียบเทียบสมรรถนะเวตสโตน	๑๙ มิ.ย. ๒๕๔๔
white bars	แท่งขาว	๑๙ มิ.ย. ๒๕๔๔
whitespace	ช่องว่าง	๑๙ มิ.ย. ๒๕๔๔
wide area information service (WAIS)	"บริการสารสนเทศบริเวณกว้าง (<a href=""/coinages/websearch.php?Wd=%E0%C7%CA%EC&amp;Sj=0"">เวส์</a>)"	๑๙ มิ.ย. ๒๕๔๔
wide area network (WAN)	"ข่ายงานบริเวณกว้าง (<a href=""/coinages/websearch.php?Wd=%E1%C7%B9&amp;Sj=0"">แวน</a>)"	๑๙ มิ.ย. ๒๕๔๔
wideband; broadband	แถบความถี่กว้าง	๑๙ มิ.ย. ๒๕๔๔
wildcard character	อักขระตัวแทน	๑๙ มิ.ย. ๒๕๔๔
Winchester disk	จานวินเชสเตอร์	๑๙ มิ.ย. ๒๕๔๔
window	"หน้าต่าง, <a href=""/coinages/websearch.php?Wd=%C7%D4%B9%E2%B4%C7%EC&amp;Sj=0"">วินโดว์</a>"	๑๙ มิ.ย. ๒๕๔๔
Windows	วินโดวส์	๑๙ มิ.ย. ๒๕๔๔
wireless LAN	แลนไร้สาย	๑๙ มิ.ย. ๒๕๔๔
wire frame model	แบบจำลองโครงลวด	๑๙ มิ.ย. ๒๕๔๔
wire printer	เครื่องพิมพ์แบบเข็ม	๑๙ มิ.ย. ๒๕๔๔
wired glove	ถุงมือสื่อข้อมูล	๑๙ มิ.ย. ๒๕๔๔
word	คำ	๑๙ มิ.ย. ๒๕๔๔
word length	ความยาวคำ	๑๙ มิ.ย. ๒๕๔๔
word processing	การประมวล(ผล)คำ	๑๙ มิ.ย. ๒๕๔๔
word processor	๑. โปรแกรมประมวลคำ<br/>๒. เครื่องประมวลคำ	๑๙ มิ.ย. ๒๕๔๔
word separation	การตัดคำ	๑๙ มิ.ย. ๒๕๔๔
wordwrap	ตัดแบ่งคำ	๑๙ มิ.ย. ๒๕๔๔
work area; work space; work storage	พื้นที่ใช้งาน	๑๙ มิ.ย. ๒๕๔๔
work collaboration	การร่วมทำงาน	๑๙ มิ.ย. ๒๕๔๔
work load	ภาระงาน	๑๙ มิ.ย. ๒๕๔๔
work space; work area; work storage	พื้นที่ใช้งาน	๑๙ มิ.ย. ๒๕๔๔
work storage; work area; work space	พื้นที่ใช้งาน	๑๙ มิ.ย. ๒๕๔๔
workbook	แฟ้มตารางทำการ	๑๙ มิ.ย. ๒๕๔๔
workflow	กระแสงาน <i>[เอกสาร]</i>	๑๙ มิ.ย. ๒๕๔๔
workflow processing	การประมวลผลกระแสงาน	๑๙ มิ.ย. ๒๕๔๔
workgroup	กลุ่มร่วมงาน	๑๙ มิ.ย. ๒๕๔๔
workgroup computing	การใช้คอมพิวเตอร์ของกลุ่มร่วมงาน	๑๙ มิ.ย. ๒๕๔๔
working set	เซตทำงาน	๑๙ มิ.ย. ๒๕๔๔
working storage	หน่วยเก็บใช้งาน	๑๙ มิ.ย. ๒๕๔๔
worksheet	ตารางทำการ	๑๙ มิ.ย. ๒๕๔๔
workstation	สถานีงาน	๑๙ มิ.ย. ๒๕๔๔
WORM disk	จานวอร์ม	๑๙ มิ.ย. ๒๕๔๔
worst fit	การจัดแล้วเหลือมากที่สุด	๑๙ มิ.ย. ๒๕๔๔
wrap around	๑. วนรอบ<br/>๒. ยกคำ <i>[ขึ้นบรรทัดใหม่]</i>	๑๙ มิ.ย. ๒๕๔๔
World Wide Web; Web (WWW)	เวิลด์ไวด์เว็บ, เว็บ	๑๙ มิ.ย. ๒๕๔๔
worm	หนอน	๑๙ มิ.ย. ๒๕๔๔
WORM (write once read many)	"วอร์ม (<a href=""/coinages/websearch.php?Wd=%E0%A2%D5%C2%B9%CB%B9%D6%E8%A7%CD%E8%D2%B9%CB%C5%D2%C2%A4%C3%D1%E9%A7&amp;Sj=0"">เขียนหนึ่งอ่านหลายครั้ง</a>)"	๑๙ มิ.ย. ๒๕๔๔
write	"เขียน, <a href=""/coinages/websearch.php?Wd=%BA%D1%B9%B7%D6%A1&amp;Sj=0"">บันทึก</a>"	๑๙ มิ.ย. ๒๕๔๔
write head; record head; writing head	หัวบันทึก	๑๙ มิ.ย. ๒๕๔๔
write once read many (WORM)	"เขียนหนึ่งอ่านหลายครั้ง (<a href=""/coinages/websearch.php?Wd=%C7%CD%C3%EC%C1&amp;Sj=0"">วอร์ม</a>)"	๑๙ มิ.ย. ๒๕๔๔
write ring	วงแหวนยอมให้บันทึก	๑๙ มิ.ย. ๒๕๔๔
write time	ช่วงเวลาบันทึก	๑๙ มิ.ย. ๒๕๔๔
writing head; record head; write head	หัวบันทึก	๑๙ มิ.ย. ๒๕๔๔
X-Y plotter	พล็อตเตอร์แบบพิกัด X-Y	๑๙ มิ.ย. ๒๕๔๔
WWW (World Wide Web; Web)	"เวิลด์ไวด์เว็บ, <a href=""/coinages/websearch.php?Wd=%E0%C7%E7%BA&amp;Sj=0"">เว็บ</a>"	๑๙ มิ.ย. ๒๕๔๔
WYSIWYG (what you see is what you get)	"วิซิวิก (<a href=""/coinages/websearch.php?Wd=%E4%B4%E9%CD%C2%E8%D2%A7%B7%D5%E8%E0%CB%E7%B9&amp;Sj=0"">ได้อย่างที่เห็น</a>)"	๑๙ มิ.ย. ๒๕๔๔
xerographic printer	เครื่องพิมพ์แบบถ่ายสำเนา	๑๙ มิ.ย. ๒๕๔๔
zero state	สถานะศูนย์	๑๙ มิ.ย. ๒๕๔๔
zero suppression	การตัดศูนย์นำหน้า	๑๙ มิ.ย. ๒๕๔๔
zap	ลบทิ้ง	๑๙ มิ.ย. ๒๕๔๔
zero flag	ตัวบ่งชี้ค่าศูนย์	๑๙ มิ.ย. ๒๕๔๔
zero level address	เลขที่อยู่ระดับศูนย์	๑๙ มิ.ย. ๒๕๔๔
zone	"เขต, <a href=""/coinages/websearch.php?Wd=%E2%AB%B9&amp;Sj=0"">โซน</a>"	๑๙ มิ.ย. ๒๕๔๔
ล็อก; ปูม; ลงบันทึก	log	๑๙ มิ.ย. ๒๕๔๔
ล้านคำสั่งต่อวินาที (มิปส์)	"million instructions per second (<a href=""/coinages/websearch.php?Wd=MIPS&amp;Sj=0"">MIPS</a>)"	๑๙ มิ.ย. ๒๕๔๔
ลักษณะประจำ	attribute	๑๙ มิ.ย. ๒๕๔๔
ลักษณะประจำข้อมูล	data attribute	๑๙ มิ.ย. ๒๕๔๔
ลายเซ็น	signature	๑๙ มิ.ย. ๒๕๔๔
(ภาษา)ลิสป์	"LISP (<a href=""/coinages/websearch.php?Wd=List+Programming&amp;Sj=0""><b>Lis</b>t <b>P</b>rogramming</a>)"	๑๙ มิ.ย. ๒๕๔๔
ลาก	drag	๑๙ มิ.ย. ๒๕๔๔
ลากแล้วปล่อย	drag-and-drop	๑๙ มิ.ย. ๒๕๔๔
ลิงซ์	Lynx	๑๙ มิ.ย. ๒๕๔๔
ลำดับ	sequence	๑๙ มิ.ย. ๒๕๔๔
ลำดับเลขสุ่ม	random number sequence	๑๙ มิ.ย. ๒๕๔๔
ลำดับอักษร	lexico-graphic order	๑๙ มิ.ย. ๒๕๔๔
ลำดับความสำคัญ, บุริมภาพ	priority	๑๙ มิ.ย. ๒๕๔๔
ลำดับชั้น	hierarchy	๑๙ มิ.ย. ๒๕๔๔
ลำดับการเรียก	calling sequence	๑๙ มิ.ย. ๒๕๔๔
ลำดับการแปลง	derivation sequence	๑๙ มิ.ย. ๒๕๔๔
ลำดับการควบคุม	control sequence	๑๙ มิ.ย. ๒๕๔๔
ลำดับชั้นชอมสกี	Chomsky hierarchy	๑๙ มิ.ย. ๒๕๔๔
ลำดับที่; จัดลำดับ	rank	๑๙ มิ.ย. ๒๕๔๔
ลินุกซ์	linux	๑๙ มิ.ย. ๒๕๔๔
ลูกโซ่, สายโซ่; โยง	chain	๑๙ มิ.ย. ๒๕๔๔
ลูกกลมวัดแรง	force ball	๑๙ มิ.ย. ๒๕๔๔
ลูกกลมควบคุม	track ball	๑๙ มิ.ย. ๒๕๔๔
ลูกกลิ้ง	capstan	๑๙ มิ.ย. ๒๕๔๔
ลงรหัส; เขียนโปรแกรม; คำสั่ง, โปรแกรม; รหัส, รหัสคำสั่ง	code	๑๙ มิ.ย. ๒๕๔๔
ลูกผสม	hybrid	๑๙ มิ.ย. ๒๕๔๔
ลงบันทึก; ปูม; ล็อก	log	๑๙ มิ.ย. ๒๕๔๔
ลงบันทึกเข้า	login	๑๙ มิ.ย. ๒๕๔๔
ลงบันทึกเปิด	logon	๑๙ มิ.ย. ๒๕๔๔
ลงบันทึกออก	logout	๑๙ มิ.ย. ๒๕๔๔
ลงบันทึกปิด	logoff	๑๙ มิ.ย. ๒๕๔๔
ลดระดับ	downgrade	๑๙ มิ.ย. ๒๕๔๔
ลบเลือนได้	volatile	๑๙ มิ.ย. ๒๕๔๔
ลบออก, ลบ, ลบทิ้ง	"delete; <a href=""/coinages/websearch.php?Wd=erase&amp;Sj=0"">erase</a>"	๑๙ มิ.ย. ๒๕๔๔
ลบล้าง, ทำให้ว่าง; ว่าง	clear	๑๙ มิ.ย. ๒๕๔๔
ลบทิ้ง	zap	๑๙ มิ.ย. ๒๕๔๔
ลบทิ้ง, ลบ, ลบออก	"delete; <a href=""/coinages/websearch.php?Wd=erase&amp;Sj=0"">erase</a>"	๑๙ มิ.ย. ๒๕๔๔
ไมม์ (ส่วนขยายสื่อประสมในระบบอินเทอร์เน็ตแบบอเนกประสงค์)	"MIME (<a href=""/coinages/websearch.php?Wd=Multipurpose+Internet+Multimedia+Extensions&amp;Sj=0""><b>M</b>ultipurpose <b>I</b>nternet <b>M</b>ultimedia <b>E</b>xtensions</a>)"	๑๙ มิ.ย. ๒๕๔๔
ลดทอนไม่ได้	irreducible	๑๙ มิ.ย. ๒๕๔๔
ลดทอนได้	reducible	๑๙ มิ.ย. ๒๕๔๔
ลบ, ลบทิ้ง, ลบออก	"delete; <a href=""/coinages/websearch.php?Wd=erase&amp;Sj=0"">erase</a>"	๑๙ มิ.ย. ๒๕๔๔
ไมโครเวฟ	microwave	๑๙ มิ.ย. ๒๕๔๔
ไมโครโปรแกรม	microprogram	๑๙ มิ.ย. ๒๕๔๔
ไมโครโพรเซสเซอร์	microprocessor	๑๙ มิ.ย. ๒๕๔๔
ไมโครวินาที	microsecond	๑๙ มิ.ย. ๒๕๔๔
ไมโครคอมพิวเตอร์	microcomputer	๑๙ มิ.ย. ๒๕๔๔
ไมโครฟิล์ม	microfilm	๑๙ มิ.ย. ๒๕๔๔
ไมโครฟิล์มสู่คอมพิวเตอร์ (ซีไอเอ็ม)	"computer input from microfilm (<a href=""/coinages/websearch.php?Wd=CIM&amp;Sj=0"">CIM</a>)"	๑๙ มิ.ย. ๒๕๔๔
ไมโครฟิล์มจากคอมพิวเตอร์ (ซีโอเอ็ม, คอม)	"computer output on microfilm (<a href=""/coinages/websearch.php?Wd=COM&amp;Sj=0"">COM</a>)"	๑๙ มิ.ย. ๒๕๔๔
ไมโครฟิช	microfiche	๑๙ มิ.ย. ๒๕๔๔
ไร้ภาวะคู่หรือคี่	nonparity	๑๙ มิ.ย. ๒๕๔๔
ไม่เชื่อมตรง, นอกสาย	off-line	๑๙ มิ.ย. ๒๕๔๔
ไร้สมาชิกร่วม	disjoint	๑๙ มิ.ย. ๒๕๔๔
ไม่สนใจ, เมิน	ignore	๑๙ มิ.ย. ๒๕๔๔
ไม่อิงดรรชนี; -จุดตรึง	fixed-point	๑๙ มิ.ย. ๒๕๔๔
ไม่ได้จัดรูปแบบ	unformatted	๑๙ มิ.ย. ๒๕๔๔
ไม่กำหนดการเชื่อมต่อ	connectionless	๑๙ มิ.ย. ๒๕๔๔
ไม่ลบเลือน	nonvolatile	๑๙ มิ.ย. ๒๕๔๔
ไม่ประสานเวลา, อสมวาร, อะซิงโครนัส	asynchronous	๑๙ มิ.ย. ๒๕๔๔
ไวรัส	virus	๑๙ มิ.ย. ๒๕๔๔
ไวยากรณ์เชิงลักษณะประจำ	attribute grammar	๑๙ มิ.ย. ๒๕๔๔
ไวยากรณ์อปรกติ	nonregular grammar	๑๙ มิ.ย. ๒๕๔๔
ไวยากรณ์ไม่พึ่งบริบท	context-free grammar	๑๙ มิ.ย. ๒๕๔๔
ไวยากรณ์ปรกติ	regular grammar	๑๙ มิ.ย. ๒๕๔๔
ไวยากรณ์พึ่งบริบท	context-sensitive grammar	๑๙ มิ.ย. ๒๕๔๔
ไวต่ออักษรใหญ่เล็ก	case sensitive	๑๙ มิ.ย. ๒๕๔๔
