-(พ่วง)ท้าย	trailer	๑๙ มิ.ย. ๒๕๔๔
in-line subroutine	"ซับรูทีนแบบแทรก <i>[มีความหมายเหมือนกับ <a href=""/coinages/websearch.php?Wd=open+subroutine&amp;Sj=0"">open subroutine</a>]</i>"	๑๙ มิ.ย. ๒๕๔๔
inclusive-or; either-or	"และ/หรือ <i>[มีความหมายเหมือนกับ <a href=""/coinages/websearch.php?Wd=join&amp;Sj=0"">join</a> ๒]</i>"	๑๙ มิ.ย. ๒๕๔๔
inconsistency	ความไม่ต้องกัน	๑๙ มิ.ย. ๒๕๔๔
increment	ส่วนเพิ่ม	๑๙ มิ.ย. ๒๕๔๔
independence	"ความไม่พึ่งพิง, <a href=""/coinages/websearch.php?Wd=%A4%C7%D2%C1%E4%C1%E8%A2%D6%E9%B9%A1%D1%BA&amp;Sj=0"">ความไม่ขึ้นกับ</a>"	๑๙ มิ.ย. ๒๕๔๔
index file	แฟ้มเก็บดรรชนี	๑๙ มิ.ย. ๒๕๔๔
index register	เรจิสเตอร์ดรรชนี	๑๙ มิ.ย. ๒๕๔๔
indexed address	"เลขที่อยู่เชิงดรรชนี <i>[มีความหมายเหมือนกับ <a href=""/coinages/websearch.php?Wd=variable+address&amp;Sj=0"">variable address</a>]</i>"	๑๙ มิ.ย. ๒๕๔๔
indexed addressing	การกำหนดเลขที่อยู่โดยดรรชนี	๑๙ มิ.ย. ๒๕๔๔
indexed file	แฟ้มดรรชนี	๑๙ มิ.ย. ๒๕๔๔
indexed sequential access method (ISAM)	"วิธีเข้าถึงลำดับดรรชนี (<a href=""/coinages/websearch.php?Wd=%E4%CD%E1%AB%C1&amp;Sj=0"">ไอแซม</a>)"	๑๙ มิ.ย. ๒๕๔๔
indexed sequential file	แฟ้มลำดับดรรชนี	๑๙ มิ.ย. ๒๕๔๔
indexed word	คำดรรชนี	๑๙ มิ.ย. ๒๕๔๔
indirect access	การเข้าถึงโดยอ้อม	๑๙ มิ.ย. ๒๕๔๔
indirect addressing	การกำหนดเลขที่อยู่โดยอ้อม	๑๙ มิ.ย. ๒๕๔๔
indicator	ตัวชี้บอก	๑๙ มิ.ย. ๒๕๔๔
inference	การอนุมาน	๑๙ มิ.ย. ๒๕๔๔
inference engine	เครื่องอนุมาน	๑๙ มิ.ย. ๒๕๔๔
infinite loop	"วงวนไม่รู้จบ <i>[มีความหมายเหมือนกับ <a href=""/coinages/websearch.php?Wd=closed+loop&amp;Sj=0"">closed loop</a> ๒]</i>"	๑๙ มิ.ย. ๒๕๔๔
infix notation	สัญกรณ์เติมกลาง	๑๙ มิ.ย. ๒๕๔๔
infobahn; information highway; information superhighway	ทางด่วนสารสนเทศ	๑๙ มิ.ย. ๒๕๔๔
informatics	สนเทศศาสตร์	๑๙ มิ.ย. ๒๕๔๔
information	"สารสนเทศ, <a href=""/coinages/websearch.php?Wd=%CA%B9%E0%B7%C8&amp;Sj=0"">สนเทศ</a>, <a href=""/coinages/websearch.php?Wd=%CA%D2%C3%B9%D4%E0%B7%C8&amp;Sj=0"">สารนิเทศ</a>"	๑๙ มิ.ย. ๒๕๔๔
information and communication technology (ICT)	"เทคโนโลยีสารสนเทศและการสื่อสาร (<a href=""/coinages/websearch.php?Wd=%E4%CD%AB%D5%B7%D5&amp;Sj=0"">ไอซีที</a>)"	๑๙ มิ.ย. ๒๕๔๔
information engineering	วิศวกรรมสารสนเทศ	๑๙ มิ.ย. ๒๕๔๔
information hiding	การซ่อนสารสนเทศ	๑๙ มิ.ย. ๒๕๔๔
information highway; infobahn; information superhighway	ทางด่วนสารสนเทศ	๑๙ มิ.ย. ๒๕๔๔
information systems	วิชาระบบสารสนเทศ	๑๙ มิ.ย. ๒๕๔๔
information technology (IT)	"เทคโนโลยีสารสนเทศ (<a href=""/coinages/websearch.php?Wd=%E4%CD%B7%D5&amp;Sj=0"">ไอที</a>)"	๑๙ มิ.ย. ๒๕๔๔
information infrastructure	โครงสร้างพื้นฐานสารสนเทศ	๑๙ มิ.ย. ๒๕๔๔
information provider	ผู้ให้บริการสารสนเทศ	๑๙ มิ.ย. ๒๕๔๔
information retrieval	การค้นคืนสารสนเทศ	๑๙ มิ.ย. ๒๕๔๔
information science	วิทยาการสารสนเทศ	๑๙ มิ.ย. ๒๕๔๔
information superhighway; infobahn; information highway	ทางด่วนสารสนเทศ	๑๙ มิ.ย. ๒๕๔๔
information system	ระบบสารสนเทศ	๑๙ มิ.ย. ๒๕๔๔
inheritance	การรับทอด	๑๙ มิ.ย. ๒๕๔๔
inhibit	ยับยั้ง	๑๙ มิ.ย. ๒๕๔๔
inhibit signal	สัญญาณยับยั้ง	๑๙ มิ.ย. ๒๕๔๔
initial program load (IPL)	"การบรรจุโปรแกรมเริ่มต้น (<a href=""/coinages/websearch.php?Wd=%E4%CD%BE%D5%E1%CD%C5&amp;Sj=0"">ไอพีแอล</a>)"	๑๙ มิ.ย. ๒๕๔๔
initialisation; initialization	การเริ่มต้น	๑๙ มิ.ย. ๒๕๔๔
initialisation; initialization	การเริ่มต้น	๑๙ มิ.ย. ๒๕๔๔
ink jet printer	เครื่องพิมพ์แบบฉีดหมึก	๑๙ มิ.ย. ๒๕๔๔
inorder	ตามลำดับ	๑๙ มิ.ย. ๒๕๔๔
input	"๑. รับเข้า, <a href=""/coinages/websearch.php?Wd=%B9%D3%E0%A2%E9%D2&amp;Sj=0"">นำเข้า</a><br/>๒. (สิ่ง)เข้า"	๑๙ มิ.ย. ๒๕๔๔
input data	ข้อมูลเข้า	๑๙ มิ.ย. ๒๕๔๔
input device	อุปกรณ์รับเข้า	๑๙ มิ.ย. ๒๕๔๔
input section	ส่วนรับเข้า	๑๙ มิ.ย. ๒๕๔๔
input unit	หน่วยรับเข้า	๑๙ มิ.ย. ๒๕๔๔
input/output (I/O)	"รับเข้า/ส่งออก, <a href=""/coinages/websearch.php?Wd=%CD%D4%B9%BE%D8%B5%2F%E0%CD%D2%B5%EC%BE%D8%B5&amp;Sj=0"">อินพุต/เอาต์พุต</a> (<a href=""/coinages/websearch.php?Wd=%E4%CD%2F%E2%CD&amp;Sj=0"">ไอ/โอ</a>)"	๑๙ มิ.ย. ๒๕๔๔
input/output buffer	บัฟเฟอร์รับเข้า/ส่งออก	๑๙ มิ.ย. ๒๕๔๔
input/output channel	ช่องรับเข้า/ส่งออก	๑๙ มิ.ย. ๒๕๔๔
input/output device	อุปกรณ์รับเข้า/ส่งออก	๑๙ มิ.ย. ๒๕๔๔
input/output instruction	คำสั่งรับเข้า/ส่งออก	๑๙ มิ.ย. ๒๕๔๔
input/output interrupt	การขัดจังหวะเพื่อรับเข้า/ส่งออก	๑๙ มิ.ย. ๒๕๔๔
input/output port	"ช่องทางเข้า/ออก <i>[มีความหมายเหมือนกับ <a href=""/coinages/websearch.php?Wd=port&amp;Sj=0"">port</a> ๑]</i>"	๑๙ มิ.ย. ๒๕๔๔
input/output unit	หน่วยรับเข้า/ส่งออก	๑๙ มิ.ย. ๒๕๔๔
Insert key; Ins key	แป้นแทรก	๑๙ มิ.ย. ๒๕๔๔
Ins key; Insert key	แป้นแทรก	๑๙ มิ.ย. ๒๕๔๔
insert mode	ภาวะแทรก	๑๙ มิ.ย. ๒๕๔๔
inside-out design	การออกแบบจากในสู่นอก	๑๙ มิ.ย. ๒๕๔๔
installation	๑. การติดตั้ง<br/>๒. สถานที่ติดตั้ง<br/>๓. ระบบเครื่องที่ติดตั้ง	๑๙ มิ.ย. ๒๕๔๔
instance	กรณีตัวอย่าง	๑๙ มิ.ย. ๒๕๔๔
instance method	วิธีกรณีตัวอย่าง	๑๙ มิ.ย. ๒๕๔๔
instance variable	ตัวแปรกรณีตัวอย่าง	๑๙ มิ.ย. ๒๕๔๔
instantiation	การสร้างกรณีตัวอย่าง	๑๙ มิ.ย. ๒๕๔๔
instruction	"๑. คำสั่ง <i>[มีความหมายเหมือนกับ <a href=""/coinages/websearch.php?Wd=program+instruction&amp;Sj=0"">program instruction</a>]</i><br/>๒. คำสั่งเครื่อง <i>[มีความหมายเหมือนกับ <a href=""/coinages/websearch.php?Wd=machine+instruction&amp;Sj=0"">machine instruction</a>]</i>"	๑๙ มิ.ย. ๒๕๔๔
instruction address	เลขที่อยู่คำสั่งเครื่อง	๑๙ มิ.ย. ๒๕๔๔
instruction counter; program counter	"ตัวนับระบุตำแหน่งคำสั่ง <i>[มีความหมายเหมือนกับ <a href=""/coinages/websearch.php?Wd=sequence+control+register&amp;Sj=0"">sequence control register</a>]</i>"	๑๙ มิ.ย. ๒๕๔๔
instruction cycle	รอบคำสั่งเครื่อง	๑๙ มิ.ย. ๒๕๔๔
instruction register	เรจิสเตอร์คำสั่งเครื่อง	๑๙ มิ.ย. ๒๕๔๔
instruction set	ชุดของคำสั่งเครื่อง	๑๙ มิ.ย. ๒๕๔๔
instruction time	เวลาทำคำสั่งเครื่อง	๑๙ มิ.ย. ๒๕๔๔
instruction word	คำบรรจุคำสั่งเครื่อง	๑๙ มิ.ย. ๒๕๔๔
integrated circuit (IC)	"วงจรรวม, <a href=""/coinages/websearch.php?Wd=%C7%A7%A8%C3%E0%BA%E7%B4%E0%CA%C3%E7%A8&amp;Sj=0"">วงจรเบ็ดเสร็จ</a> (<a href=""/coinages/websearch.php?Wd=%E4%CD%AB%D5&amp;Sj=0"">ไอซี</a>)"	๑๙ มิ.ย. ๒๕๔๔
integer	จำนวนเต็ม	๑๙ มิ.ย. ๒๕๔๔
integer programming	กำหนดการเชิงจำนวนเต็ม	๑๙ มิ.ย. ๒๕๔๔
integrated development environment (IDE)	สิ่งแวดล้อมสำหรับการพัฒนาแบบเบ็ดเสร็จ (ไอดีอี)	๑๙ มิ.ย. ๒๕๔๔
integrated drive electronics (IDE)	"ชุดอิเล็กทรอนิกส์ควบคุมหน่วยขับเบ็ดเสร็จ (<a href=""/coinages/websearch.php?Wd=%E4%CD%B4%D5%CD%D5&amp;Sj=0"">ไอดีอี</a>)"	๑๙ มิ.ย. ๒๕๔๔
integrated network	ข่ายงานแบบเบ็ดเสร็จ	๑๙ มิ.ย. ๒๕๔๔
integrated services digital network (ISDN)	"โครงข่ายบริการสื่อสารร่วมระบบดิจิทัล (<a href=""/coinages/websearch.php?Wd=%E4%CD%E0%CD%CA%B4%D5%E0%CD%E7%B9&amp;Sj=0"">ไอเอสดีเอ็น</a>)"	๑๙ มิ.ย. ๒๕๔๔
integrated software	"ส่วนชุดคำสั่งเบ็ดเสร็จ, <a href=""/coinages/websearch.php?Wd=%AB%CD%BF%B5%EC%E1%C7%C3%EC%E0%BA%E7%B4%E0%CA%C3%E7%A8&amp;Sj=0"">ซอฟต์แวร์เบ็ดเสร็จ</a>"	๑๙ มิ.ย. ๒๕๔๔
integration test	การทดสอบเบ็ดเสร็จ	๑๙ มิ.ย. ๒๕๔๔
integrity	บูรณภาพ	๑๙ มิ.ย. ๒๕๔๔
intelligent terminal	เครื่องปลายทางอัจฉริยะ	๑๙ มิ.ย. ๒๕๔๔
interaction diagram	แผนภาพแสดงการโต้ตอบ	๑๙ มิ.ย. ๒๕๔๔
interactive	เชิงโต้ตอบ	๑๙ มิ.ย. ๒๕๔๔
interactive mode	ภาวะเชิงโต้ตอบ	๑๙ มิ.ย. ๒๕๔๔
interactive processing	การประมวลผลแบบโต้ตอบ	๑๙ มิ.ย. ๒๕๔๔
interblock gap	"๑. ช่องว่างระหว่างกลุ่มระเบียน<br/>๒. ช่องว่างระหว่างบล็อก <i>[มีความหมายเหมือนกับ <a href=""/coinages/websearch.php?Wd=interrecord+gap&amp;Sj=0"">interrecord gap</a>]</i>"	๑๙ มิ.ย. ๒๕๔๔
interconnectedness	ความเชื่อมโยงถึงกัน	๑๙ มิ.ย. ๒๕๔๔
interchange	การสับเปลี่ยน	๑๙ มิ.ย. ๒๕๔๔
interface	"๑. ต่อประสาน<br/>๒. ส่วนต่อประสาน, <a href=""/coinages/websearch.php?Wd=%B5%D1%C7%B5%E8%CD%BB%C3%D0%CA%D2%B9&amp;Sj=0"">ตัวต่อประสาน</a><br/>๓. โปรแกรมต่อประสาน"	๑๙ มิ.ย. ๒๕๔๔
interface card	แผ่นวงจรต่อประสาน	๑๙ มิ.ย. ๒๕๔๔
interior node	"บัพภายใน <i>[มีความหมายเหมือนกับ <a href=""/coinages/websearch.php?Wd=branch+node&amp;Sj=0"">branch node</a> และ <a href=""/coinages/websearch.php?Wd=nonleaf+node&amp;Sj=0"">nonleaf node</a>; <a href=""/coinages/websearch.php?Wd=nonterminal+node&amp;Sj=0"">nonterminal node</a>]</i>"	๑๙ มิ.ย. ๒๕๔๔
interlace	สอดประสาน	๑๙ มิ.ย. ๒๕๔๔
interleave	๑. แทรกสลับ<br/>๒. สลับ	๑๙ มิ.ย. ๒๕๔๔
intermediate system (IS)	"ระบบระหว่างกลาง (<a href=""/coinages/websearch.php?Wd=%E4%CD%E0%CD%CA&amp;Sj=0"">ไอเอส</a>)"	๑๙ มิ.ย. ๒๕๔๔
internal fragmentation	การแตกกระจายภายใน	๑๙ มิ.ย. ๒๕๔๔
International Organization for Standardization (ISO)	"องค์การระหว่างประเทศว่าด้วยการมาตรฐาน (<a href=""/coinages/websearch.php?Wd=%E4%CD%E2%AB&amp;Sj=0"">ไอโซ</a>)"	๑๙ มิ.ย. ๒๕๔๔
internationalisation; internationalization	สากลวิวัตน์	๑๙ มิ.ย. ๒๕๔๔
internationalization; internationalisation	สากลวิวัตน์	๑๙ มิ.ย. ๒๕๔๔
Internet	อินเทอร์เน็ต	๑๙ มิ.ย. ๒๕๔๔
Internet Access Provider (IAP)	"ผู้ให้บริการเข้าถึงอินเทอร์เน็ต (<a href=""/coinages/websearch.php?Wd=%E4%CD%E0%CD%BE%D5&amp;Sj=0"">ไอเอพี</a>)"	๑๙ มิ.ย. ๒๕๔๔
Internet address	เลขที่อยู่อินเทอร์เน็ต	๑๙ มิ.ย. ๒๕๔๔
Internet Packet Exchange (IPX)	"เกณฑ์วิธีแลกเปลี่ยนกลุ่มข้อมูลระหว่างเครือข่าย (<a href=""/coinages/websearch.php?Wd=%E4%CD%BE%D5%E0%CD%A1%AB%EC&amp;Sj=0"">ไอพีเอกซ์</a>)"	๑๙ มิ.ย. ๒๕๔๔
Internet Protocol (IP)	"เกณฑ์วิธีอินเทอร์เน็ต (<a href=""/coinages/websearch.php?Wd=%E4%CD%BE%D5&amp;Sj=0"">ไอพี</a>)"	๑๙ มิ.ย. ๒๕๔๔
Internet Relay Chat (IRC)	"การคุยผ่านอินเทอร์เน็ต (<a href=""/coinages/websearch.php?Wd=%E4%CD%CD%D2%C3%EC%AB%D5&amp;Sj=0"">ไออาร์ซี</a>)"	๑๙ มิ.ย. ๒๕๔๔
Internet Service Provider (ISP)	"ผู้ให้บริการอินเทอร์เน็ต (<a href=""/coinages/websearch.php?Wd=%E4%CD%E0%CD%CA%BE%D5&amp;Sj=0"">ไอเอสพี</a>)"	๑๙ มิ.ย. ๒๕๔๔
interpreter	"๑. โปรแกรมแปลคำสั่ง, <a href=""/coinages/websearch.php?Wd=%CD%D4%B9%E0%B7%CD%C3%EC%BE%C3%D5%E0%B5%CD%C3%EC&amp;Sj=0"">อินเทอร์พรีเตอร์</a><br/>๒. ตัวแปลคำสั่ง"	๑๙ มิ.ย. ๒๕๔๔
interpolation	การประมาณค่าในช่วง	๑๙ มิ.ย. ๒๕๔๔
interrecord gap	"ช่องว่างระหว่างระเบียน <i>[มีความหมายเหมือนกับ <a href=""/coinages/websearch.php?Wd=interblock+gap&amp;Sj=0"">interblock gap</a> ๒]</i>"	๑๙ มิ.ย. ๒๕๔๔
interrupt	"๑. ขัดจังหวะ<br/>๒. สัญญาณขัดจังหวะ<br/>๓. การขัดจังหวะ <i>[มีความหมายเหมือนกับ <a href=""/coinages/websearch.php?Wd=interruption&amp;Sj=0"">interruption</a>]</i>"	๑๙ มิ.ย. ๒๕๔๔
interrupt handler	ชุดคำสั่งจัดเรื่องขัดจังหวะ	๑๙ มิ.ย. ๒๕๔๔
interrupt request line (IRQ)	"สายสัญญาณขอขัดจังหวะ (<a href=""/coinages/websearch.php?Wd=%E4%CD%CD%D2%C3%EC%A4%D4%C7&amp;Sj=0"">ไออาร์คิว</a>)"	๑๙ มิ.ย. ๒๕๔๔
interruption	"การขัดจังหวะ <i>[มีความหมายเหมือนกับ <a href=""/coinages/websearch.php?Wd=interrupt&amp;Sj=0"">interrupt</a> ๓]</i>"	๑๙ มิ.ย. ๒๕๔๔
intranet	อินทราเน็ต	๑๙ มิ.ย. ๒๕๔๔
invariant	๑. ยืนยง<br/>๒. ตัวยืนยง	๑๙ มิ.ย. ๒๕๔๔
inversion	การผกผัน	๑๙ มิ.ย. ๒๕๔๔
inverted file	แฟ้มผกผัน	๑๙ มิ.ย. ๒๕๔๔
inverter	ตัวผกผัน	๑๙ มิ.ย. ๒๕๔๔
(ภาษา)อัลกอล	"ALGOL (<a href=""/coinages/websearch.php?Wd=ALgorithmic+Language&amp;Sj=0""><b>ALgo</b>rithmic <b>L</b>anguage</a>)"	๑๙ มิ.ย. ๒๕๔๔
อักขระ	character	๑๙ มิ.ย. ๒๕๔๔
อักขระเมิน	ignore character	๑๙ มิ.ย. ๒๕๔๔
อักขระเกิน	redundant character	๑๙ มิ.ย. ๒๕๔๔
อักขระเข้ารหัสฐานสอง	binary coded character	๑๙ มิ.ย. ๒๕๔๔
อักขระเติมหน้า	prefix character	๑๙ มิ.ย. ๒๕๔๔
อักขระเพิ่มเติม	additional character	๑๙ มิ.ย. ๒๕๔๔
อักขระว่าง	space character	๑๙ มิ.ย. ๒๕๔๔
อักขระหลีก	escape character	๑๙ มิ.ย. ๒๕๔๔
อักขระลบทิ้ง	erase character	๑๙ มิ.ย. ๒๕๔๔
อักขระข้อมูล	data character	๑๙ มิ.ย. ๒๕๔๔
อักขระขึ้นต้นบรรทัดใหม่ (ซีอาร์แอลเอฟ)	"carriage-return line feed (<a href=""/coinages/websearch.php?Wd=CRLF&amp;Sj=0"">CRLF</a>)"	๑๙ มิ.ย. ๒๕๔๔
อักขระควบคุม	control character	๑๙ มิ.ย. ๒๕๔๔
อักขระควบคุมอุปกรณ์	device control character	๑๙ มิ.ย. ๒๕๔๔
อักขระคั่น	delimiter	๑๙ มิ.ย. ๒๕๔๔
อักขระคั่นข้อมูล	data delimiter	๑๙ มิ.ย. ๒๕๔๔
อักขระตรวจสอบ	check character	๑๙ มิ.ย. ๒๕๔๔
อักขระตรวจสอบมอดูล	modular check character	๑๙ มิ.ย. ๒๕๔๔
อักขระต่อวินาที (ซีพีเอส)	"characters per second (<a href=""/coinages/websearch.php?Wd=CPS&amp;Sj=0"">CPS</a>)"	๑๙ มิ.ย. ๒๕๔๔
อักขระตัวแทน	wildcard character	๑๙ มิ.ย. ๒๕๔๔
อักขระตั้งระยะ	tab character	๑๙ มิ.ย. ๒๕๔๔
อักขระประสานเวลา	sync character	๑๙ มิ.ย. ๒๕๔๔
อักขระพิเศษ	special character	๑๙ มิ.ย. ๒๕๔๔
อัดแน่น	pack	๑๙ มิ.ย. ๒๕๔๔
อัฐนิยม; ฐานแปด	octal	๑๙ มิ.ย. ๒๕๔๔
อัตราสัญญาณนาฬิกา	clock rate	๑๙ มิ.ย. ๒๕๔๔
อัตราส่วนกิจกรรม	activity ratio	๑๙ มิ.ย. ๒๕๔๔
อัตราส่วนปฏิบัติการ	operating ratio	๑๙ มิ.ย. ๒๕๔๔
อัตราการแปลงผัน	conversion rate	๑๙ มิ.ย. ๒๕๔๔
อัตราการกราดตรวจ	scanning rate	๑๙ มิ.ย. ๒๕๔๔
อัตราการชักตัวอย่าง	sampling rate	๑๙ มิ.ย. ๒๕๔๔
อัตราความผิดพลาด	error rate	๑๙ มิ.ย. ๒๕๔๔
อัตราถ่ายโอน	transfer rate	๑๙ มิ.ย. ๒๕๔๔
อัตราถ่ายโอนข้อมูล	data transfer rate	๑๙ มิ.ย. ๒๕๔๔
อัตราบิต	bit rate	๑๙ มิ.ย. ๒๕๔๔
อันดับเรียงตามสดมภ์	column-major order	๑๙ มิ.ย. ๒๕๔๔
ฮับ	hub	๑๙ มิ.ย. ๒๕๔๔
อีเมล (ไปรษณีย์อิเล็กทรอนิกส์); ส่งอีเมล (ส่งไปรษณีย์อิเล็กทรอนิกส์)	"e-mail (<a href=""/coinages/websearch.php?Wd=electronic+mail&amp;Sj=0"">electronic mail</a>)"	๑๙ มิ.ย. ๒๕๔๔
อีโอเอฟ (สิ้นสุดแฟ้ม)	"EOF (<a href=""/coinages/websearch.php?Wd=end+of+file&amp;Sj=0"">end of file</a>)"	๑๙ มิ.ย. ๒๕๔๔
อาร์เอฟไอ (เอกสารขอสารสนเทศ)	"RFI (<a href=""/coinages/websearch.php?Wd=request+for+information&amp;Sj=0"">request for information</a>)"	๑๙ มิ.ย. ๒๕๔๔
อาร์เอฟคิว (เอกสารเชิญชวนเสนอราคา)	"RFQ (<a href=""/coinages/websearch.php?Wd=request+for+quotation&amp;Sj=0"">request for quotation</a>)"	๑๙ มิ.ย. ๒๕๔๔
อาร์เอฟซี (เอกสารขอความเห็น)	"RFC (<a href=""/coinages/websearch.php?Wd=request+for+comment&amp;Sj=0"">request for comment</a>)"	๑๙ มิ.ย. ๒๕๔๔
อาร์เอฟพี (เอกสารเชิญชวนยื่นข้อเสนอ)	"RFP (<a href=""/coinages/websearch.php?Wd=request+for+proposal&amp;Sj=0"">request for proposal</a>)"	๑๙ มิ.ย. ๒๕๔๔
อาร์กิวเมนต์	argument	๑๙ มิ.ย. ๒๕๔๔
อาร์เจอี (การรับงานระยะไกล)	"RJE (<a href=""/coinages/websearch.php?Wd=remote+job+entry&amp;Sj=0"">remote job entry</a>)"	๑๙ มิ.ย. ๒๕๔๔
อาร์ชี	Archie	๑๙ มิ.ย. ๒๕๔๔
ฮาร์ดแวร์, ส่วนเครื่อง; ส่วนอุปกรณ์, ฮาร์ดแวร์	hardware	๑๙ มิ.ย. ๒๕๔๔
ฮาร์ดล็อก	hard lock	๑๙ มิ.ย. ๒๕๔๔
อาร์พีเอ็น (สัญกรณ์โพลิชผันกลับ)	"RPN (<a href=""/coinages/websearch.php?Wd=reverse+Polish+notation&amp;Sj=0"">reverse Polish notation</a>)"	๑๙ มิ.ย. ๒๕๔๔
อาร์พาเน็ต (เครือข่ายสำนักงานโครงการวิจัยขั้นสูง)	"ARPANET (<a href=""/coinages/websearch.php?Wd=Advanced+Research+Projects+Agency+Network&amp;Sj=0""><b>A</b>dvanced <b>R</b>esearch <b>P</b>rojects <b>A</b>gency <b>Net</b>work</a>)"	๑๙ มิ.ย. ๒๕๔๔
(ภาษา)อาร์พีจี	"RPG (<a href=""/coinages/websearch.php?Wd=Report+Program+Generator&amp;Sj=0"">Report Program Generator</a>)"	๑๙ มิ.ย. ๒๕๔๔
อีเทอร์เน็ต	Ethernet	๑๙ มิ.ย. ๒๕๔๔
อิมพัลส์	impulse	๑๙ มิ.ย. ๒๕๔๔
อีอีพร็อม (หน่วยความจำอ่านอย่างเดียวชนิดโปรแกรมและลบได้ด้วยกระแสไฟฟ้า)	"EEPROM (<a href=""/coinages/websearch.php?Wd=electrically+erasable+PROM&amp;Sj=0"">electrically erasable PROM</a>)"	๑๙ มิ.ย. ๒๕๔๔
อีไอเอส (ระบบสารสนเทศเพื่อผู้บริหาร)	"EIS (<a href=""/coinages/websearch.php?Wd=executive+information+system&amp;Sj=0"">executive information system</a>)"	๑๙ มิ.ย. ๒๕๔๔
อีคอมเมิร์ซ (การพาณิชย์อิเล็กทรอนิกส์)	"e-commerce (<a href=""/coinages/websearch.php?Wd=electronic+commerce&amp;Sj=0"">electronic commerce</a>)"	๑๙ มิ.ย. ๒๕๔๔
อิงดรรชนี; -จุดลอยตัว	floating-point	๑๙ มิ.ย. ๒๕๔๔
อีจีเอ (ตัวปรับภาพกราฟิกส์เพิ่มความคม)	"EGA (<a href=""/coinages/websearch.php?Wd=enhanced+graphics+adapter&amp;Sj=0"">enhanced graphics adapter</a>)"	๑๙ มิ.ย. ๒๕๔๔
อาชญากรรมไซเบอร์	cybercrime	๑๙ มิ.ย. ๒๕๔๔
อินเทอร์เน็ต	Internet	๑๙ มิ.ย. ๒๕๔๔
